Product Name,Price,Price per Unit
Sunsilk Summer Care Shampoo Coconut Oil & Hibiscus 700ml,$12.00,$1.71 / 100ML
Cancer Council Ultra Spf 50+ Sunscreen 110ml,$14.00,$12.73 / 100ML
Selsun Gold Anti Dandruff Shampoo Treatment 200ml,$11.30,$5.65 / 100ML
Stayfree Ultra Thin Light Pads Pads With Wings 16 Pack,$4.20,$0.26 / 1EA
Nivea Sun Protect & Moisture Lock Sunscreen Lotion Spf50+ 400ml,$26.00,$6.50 / 100ML
Sukin Hydrating Conditioner 500ml,$9.50,$1.90 / 100ML
Sensodyne Toothbrush Sensitive Teeth Repair And Protect 2 Pack,$9.00,$4.50 / 1EA
Herbal Essences Shampoo Hello Hydration 300ml,$7.00,$2.33 / 100ML
Essentials Facial Tissues 224 Pack,$1.70,$0.76 / 100SS
Kleenex Everyday 2 Ply Facial Tissues 200 Pack,$3.00,$1.50 / 100SS
Quilton Facial Tissues Soft White 95 Pack,$1.40,$1.47 / 100SS
Kleenex Aloe Vera & Vitamin E 3 Ply Facial Tissues 95 Pack,$2.60,$2.74 / 100SS
Kleenex Aloe Vera & Vitamin E 3 Ply Facial Tissues 140 Pack,$3.60,$2.57 / 100SS
Symphony Facial Tissues White 228ss 3 Pack,$5.00,$0.73 / 100SS
Kleenex Large & Thick 3 Ply Facial Tissues 95 Pack,$2.80,$2.95 / 100SS
Swisspers Cotton Tips 240 Pack,$4.80,$2.00 / 100EA
Tena Pads Maxi 6 Pack,$4.40,$0.73 / 1EA
Cancer Council Kids Spf 50+ Sunscreen 110ml,$14.00,$12.73 / 100ML
Cancer Council Sensitive Sunscreen Pump Bottle Spf 50 Plus 200ml,$18.00,$9.00 / 100ML
Oral-b Stages 3 Manual Kids Toothbrush 5-7 Years Disney Each,$3.55,$3.55 / 1EA
Palmolive Naturals Liquid Hand Wash Soap Aloe Vera & Chamomile 250ml,$1.50,$0.60 / 100ML
Palmolive Luminous Oils Coconut Oil & Frangipani Shampoo 350ml,$4.80,$1.37 / 100ML
Rexona Men Antiperspirant Aerosol Deodorant Sport Fresh 250ml,$6.00,$2.40 / 100ML
Strepsils Extra Blackcurrant Sore Throat Fast Numbing Throat Lozenges 16 Pack,$9.00,$0.56 / 1EA
Sukin Natural Balance Shampoo 500ml,$9.50,$1.90 / 100ML
Vicks Vapodrop Throat Lozenges Butter Menthol 24 Pack,$5.90,$0.25 / 1EA
Palmolive Foaming Liquid Hand Wash Soap Pump Vanilla & Berry 250ml,$2.00,$0.80 / 100ML
Grants Of Australia Whitening Toothpaste With Baking Soda 110g,$4.30,$3.91 / 100G
Redwin Sorbolene Daily Moisturiser 1.1l,$6.60,$0.60 / 100ML
Sukin Natural Balance Shampoo 1l,$23.00,$2.30 / 100ML
Sensodyne Dual Action Toothpaste 100g,$12.30,$12.30 / 100G
Colgate Advanced Whitening Tartar Control Toothpaste Pump 130g,$9.00,$6.92 / 100G
Sunsilk Clean & Fresh Shampoo 700ml,$12.00,$1.71 / 100ML
Colgate 360 Whole Mouth Clean Medium Manual Toothbrush Each,$5.00,$5.00 / 1EA
Oscar Orsen Tweezers Slant/ Point Tip Each,$6.49,$6.49 / 1EA
Sukin Signature Facial Moisturiser Pump 125ml,$7.50,$6.00 / 100ML
Colgate Total Charcoal Deep Clean Antibacterial Toothpaste 200g,$5.00,$2.50 / 100G
Palmolive Antibacterial Liquid Hand Wash Soap Lime Refill 1l,$7.00,$0.70 / 100ML
Colgate Advanced Whitening Charcoal Toothpaste 180g,$5.00,$2.78 / 100G
Colgate Toothbrush Toothpaste Mouthwash & Floss Travel Pack Each,$9.00,$9.00 / 1EA
Essentials Facial Tissues 224 Pack,$1.70,$0.76 / 100SS
Kleenex Everyday 2 Ply Facial Tissues 200 Pack,$3.00,$1.50 / 100SS
Quilton Facial Tissues Soft White 95 Pack,$1.40,$1.47 / 100SS
Kleenex Aloe Vera & Vitamin E 3 Ply Facial Tissues 95 Pack,$2.60,$2.74 / 100SS
Kleenex Aloe Vera & Vitamin E 3 Ply Facial Tissues 140 Pack,$3.60,$2.57 / 100SS
Symphony Facial Tissues White 228ss 3 Pack,$5.00,$0.73 / 100SS
Kleenex Large & Thick 3 Ply Facial Tissues 95 Pack,$2.80,$2.95 / 100SS
Swisspers Cotton Tips 240 Pack,$4.80,$2.00 / 100EA
Essentials Facial Tissues 224 Pack,$1.70,$0.76 / 100SS
Kleenex Everyday 2 Ply Facial Tissues 200 Pack,$3.00,$1.50 / 100SS
Quilton Facial Tissues Soft White 95 Pack,$1.40,$1.47 / 100SS
Kleenex Aloe Vera & Vitamin E 3 Ply Facial Tissues 95 Pack,$2.60,$2.74 / 100SS
Kleenex Aloe Vera & Vitamin E 3 Ply Facial Tissues 140 Pack,$3.60,$2.57 / 100SS
Symphony Facial Tissues White 228ss 3 Pack,$5.00,$0.73 / 100SS
Kleenex Large & Thick 3 Ply Facial Tissues 95 Pack,$2.80,$2.95 / 100SS
Swisspers Cotton Tips 240 Pack,$4.80,$2.00 / 100EA
Colgate 360 Whole Mouth Clean Soft Manual Toothbrush Each,$5.00,$5.00 / 1EA
"Palmolive Travel Hand Sanitiser, Shampoo , Conditioner & Body Wash Each",$9.00,$9.00 / 1EA
Sukin Art Series Anna Cole Hand Wash 500ml,$5.50,$1.10 / 100ML
Nivea Sun Kids Roll On Sunscreen For Kids Spf50 65ml,$14.00,$21.54 / 100ML
Carefree Flexia Fragrance Free Super Tampons 16 Pack,$4.20,$0.26 / 1EA
Colgate Optic White Expert Express Teeth Whitening Toothpaste 125g,$15.00,$12.00 / 100G
Bic Razor Disposable Soleil Twilight Lavender 4 Pack,$4.30,$1.08 / 1EA
Palmolive Foaming Liquid Hand Wash Soap Japanese Cherry Blossom 500ml,$4.00,$0.80 / 100ML
Tresemme Smooth & Silky Shampoo Sunflower Seed Oil & Vitamin A 940ml,$9.80,$1.04 / 100ML
Vaseline Intensive Care Body Lotion Deep Restore 750ml,$16.00,$2.13 / 100ML
Palmolive Naturals Intensive Shampoo Coco Cream & Milk Protein 700ml,$7.00,$1.00 / 100ML
Oral-b Kids Fluoride Toothpaste 3-6 Years 92g,$3.50,$3.80 / 100G
Ogx Argan Oil Extra Strength Shampoo For Damaged Hair 385ml,$12.50,$3.25 / 100ML
Oral-b 3d White Luxe Diamond Strong Fluoride Whitening Toothpaste 95g,$10.00,$10.53 / 100G
White Glo Professional White Whitening Toothpaste 205g,$4.50,$2.20 / 100G
Schick Xtreme 3 Womens Sensitive Disposable Razor 4 Pack,$5.50,$1.38 / 1EA
L'oreal Elvive Extraordinary Oil Coconut Shampoo 300ml,$8.50,$2.83 / 100ML
Balnea Toothbrush Holder Assorted Each,$1.00,$1.00 / 1EA
Freshwater Farm Australia Hemp Seed Oil Hydrating Body Bar 200g,$4.50,$2.25 / 100G
Sukin Original Hydrating Mist Toner Spray 125ml,$7.00,$5.60 / 100ML
Palmolive Naturals Travel Body Wash Milk & Honey Shower Gel 100ml,$2.20,$2.20 / 100ML
Vicks Nasal Decongestant Inhaler Twin Pack 2 X 0.5ml,$14.90,$7.45 / 1EA
Cedel Toothpaste Spearmint 110g,$3.00,$2.73 / 100G
Cedel Toothpaste Sensitive 110g,$5.20,$4.73 / 100G
Essentials Facial Tissues 224 Pack,$1.70,$0.76 / 100SS
Kleenex Everyday 2 Ply Facial Tissues 200 Pack,$3.00,$1.50 / 100SS
Quilton Facial Tissues Soft White 95 Pack,$1.40,$1.47 / 100SS
Kleenex Aloe Vera & Vitamin E 3 Ply Facial Tissues 95 Pack,$2.60,$2.74 / 100SS
Kleenex Aloe Vera & Vitamin E 3 Ply Facial Tissues 140 Pack,$3.60,$2.57 / 100SS
Symphony Facial Tissues White 228ss 3 Pack,$5.00,$0.73 / 100SS
Kleenex Large & Thick 3 Ply Facial Tissues 95 Pack,$2.80,$2.95 / 100SS
Swisspers Cotton Tips 240 Pack,$4.80,$2.00 / 100EA
Neutrogena T/gel Anti-dandruff Therapeutic Shampoo 200ml,$15.00,$7.50 / 100ML
Balnea Pure Soap 8 Pack,$4.50,$0.56 / 1EA
Palmolive Antibacterial Foaming Liquid Hand Wash Soap Limited Edition 250ml,$2.00,$0.80 / 100ML
Sorbent Thick & Large Hypoallergenic Facial Tissues 95 Pack,$2.20,$2.32 / 100SS
Voltaren Muscle And Back Pain Relief Emulgel 50g,$11.00,$22.00 / 100G
Tena Active Panty Liners Long 39 Pack,$5.50,$0.14 / 1EA
Stayfree Super Pads Super No Wings 18 Pack,$4.90,$0.27 / 1EA
Sorbent Everyday White Facial Tissues 150 Pack,$1.90,$1.27 / 100SS
Dettol Antibacterial Liquid Hand Wash Pump Refresh 250ml,$2.80,$1.12 / 100ML
Sambucol Cough Syrups Cold & Flu Liquid 120ml,$14.40,$12.00 / 100ML
Ozguard Hand Sanitiser 750ml,$15.00,$2.00 / 100ML
Palmolive Naturals Active Nourishment Shampoo Aloe Vera & Fruit 700ml,$7.00,$1.00 / 100ML
Colgate Total 12 Sensitivity + Gum Health Toothpaste 200g,$5.00,$2.50 / 100G
Schwarzkopf Extra Care Marrakesh Oil & Coconut Replenishing Shampoo 400ml,$9.00,$2.25 / 100ML
L'oreal Elvive Total Repair Shampoo 300ml,$8.50,$2.83 / 100ML
Systane Ultra Eye Drops 10ml,$11.50,$115.00 / 100ML
Dove Beauty Cream Bar Sensitive Soap 90g X 2 Pack,$4.20,$2.33 / 100G
Steradent Denture Cleansing Tablets Active Plus 48 Pack,$8.50,$0.18 / 1EA
Tresemme Smooth & Silky Conditioner Sunflower Seed Oil & Vitamin A 940ml,$9.80,$1.04 / 100ML
Redwin Sensitive Skin Restoring Sorbolene Soap Free Body Wash 1l,$13.00,$1.30 / 100ML
Vaseline Intensive Care Body Lotion Aloe Soothe 750ml,$16.00,$2.13 / 100ML
Colgate Kids Anticavity Fluoride Toothpaste 0-3 Yrs Mild Fruit 80g,$4.00,$5.00 / 100G
Strepsils Extra Honey And Lemon Sore Throat Fast Numb Lozenges 36 Pack,$17.00,$0.47 / 1EA
Eureka Tea Tree Solution 200ml,$9.80,$4.90 / 100ML
Essentials Facial Tissues 224 Pack,$1.70,$0.76 / 100SS
Kleenex Everyday 2 Ply Facial Tissues 200 Pack,$3.00,$1.50 / 100SS
Quilton Facial Tissues Soft White 95 Pack,$1.40,$1.47 / 100SS
Kleenex Aloe Vera & Vitamin E 3 Ply Facial Tissues 95 Pack,$2.60,$2.74 / 100SS
Kleenex Aloe Vera & Vitamin E 3 Ply Facial Tissues 140 Pack,$3.60,$2.57 / 100SS
Symphony Facial Tissues White 228ss 3 Pack,$5.00,$0.73 / 100SS
Kleenex Large & Thick 3 Ply Facial Tissues 95 Pack,$2.80,$2.95 / 100SS
Swisspers Cotton Tips 240 Pack,$4.80,$2.00 / 100EA
Carefree Flexia Fragrance Free Regular Tampons 16 Pack,$4.20,$0.26 / 1EA
Colgate Optic White Renewal Lasting Fresh Whitening Toothpaste 85g,$7.50,$8.82 / 100G
Sunsilk Total Care 2 In 1 Shampoo & Conditioner 350ml,$6.50,$1.86 / 100ML
Redwin Sorbolene Hand Cream With Vitamin E 100g,$2.10,$2.10 / 100G
Balnea Travel Bottles 3 Pack,$4.50,$4.50 / 1EA
Tresemme Cleanse & Replenish Conditioner 940ml,$9.80,$1.04 / 100ML
Nivea Sun Protect & Moisture Lock Sunscreen Spray Spf50+ 300ml,$26.00,$8.67 / 100ML
Sudafed Pe Nasal Decongestant 20 Pack,$14.00,$0.70 / 1EA
My Soda Hydrate Shampoo 350ml,$10.00,$2.86 / 100ML
Sunsilk Shampoo Defeat Damage 700ml,$12.00,$1.71 / 100ML
Manicare Slant Tweezer Gold Tipped Each,$11.60,$11.60 / 1EA
Sukin Signature Hydrating Body Lotion Pump 500ml,$8.00,$1.60 / 100ML
Stingose Antiseptic Gel Tube 25g,$9.95,$39.80 / 100G
Colgate Max White Medium Bristles Manual Toothbrush Value Pack 3 Pack,$5.00,$1.67 / 1EA
Cancer Council Spf 50+ Sunscreen Ultra 75ml,$10.40,$13.87 / 100ML
Swisspers Cotton Tips With Paper Stems 120 Pack,$3.20,$2.67 / 100EA
All Smiles Bamboo Toothbrush Medium 4 Pack,$6.00,$1.50 / 1EA
Simple Kind To Skin Light Moisturiser Hydrating 125ml,$8.00,$6.40 / 100ML
Stayfree Regular Pads Regular No Wings 20 Pack,$4.90,$0.25 / 1EA
Help@hand Epsom Salt 1kg,$6.00,$0.60 / 100G
Stayfree Super Pads With Wings 18 Pack,$4.90,$0.27 / 1EA
Stayfree Regular Pads With Wings 20 Pack,$4.90,$0.25 / 1EA
White Glo Professional White Whitening Toothpaste 115g,$3.00,$2.61 / 100G
Essentials Facial Tissues 224 Pack,$1.70,$0.76 / 100SS
Kleenex Everyday 2 Ply Facial Tissues 200 Pack,$3.00,$1.50 / 100SS
Quilton Facial Tissues Soft White 95 Pack,$1.40,$1.47 / 100SS
Kleenex Aloe Vera & Vitamin E 3 Ply Facial Tissues 95 Pack,$2.60,$2.74 / 100SS
Kleenex Aloe Vera & Vitamin E 3 Ply Facial Tissues 140 Pack,$3.60,$2.57 / 100SS
Symphony Facial Tissues White 228ss 3 Pack,$5.00,$0.73 / 100SS
Kleenex Large & Thick 3 Ply Facial Tissues 95 Pack,$2.80,$2.95 / 100SS
Swisspers Cotton Tips 240 Pack,$4.80,$2.00 / 100EA
Sunsilk Conditioner Summer Care 700ml,$12.00,$1.71 / 100ML
White Glo Charcoal Deep Stain Remover Whitening Toothpaste 205g,$4.50,$2.20 / 100G
Oc Naturals Conditioner Normal Balance 725ml,$6.40,$0.88 / 100ML
Sukin Natural Balance Conditioner 500ml,$9.50,$1.90 / 100ML
Bosisto's Tea Tree Spray 125g,$13.00,$10.40 / 100G
Nfco Bio Toothbrush Assorted 2 Pack,$10.00,$5.00 / 1EA
Sukin Cleansing Hand Wash Eucalyptus & Tea Tree Pump 500ml,$5.50,$1.10 / 100ML
Zyrtec Rapid Acting Allergy & Hayfever Antihistamine Relief 10 Gel Capsules,$14.50,$1.45 / 1EA
Strepsils Plus Anaesthetic Sore Throat Numbing Pain Relief Lozenges 36 Pack,$17.00,$0.47 / 1EA
Sunsilk Summer Care Conditioner 350ml,$6.50,$1.86 / 100ML
Sudafed Pe Sinus + Anti-inflammatory Pain Relief Double Action 20 Pack,$16.50,$0.83 / 1EA
Zovirax Cold Sore Cream 2g,$16.80,$84.00 / 10G
Tena Pads Instadry Long Length 8 Pack,$4.40,$0.55 / 1EA
L'oreal Elvive Dream Lengths Restoring Shampoo 300ml,$8.50,$2.83 / 100ML
Rexona Women Advanced Protection Invisible Dry Pure 220ml,$9.50,$4.32 / 100ML
Pantene Ultimate 10 Repair & Protect Shampoo For Damage 900ml,$10.00,$1.11 / 100ML
Garnier Eye Tissue Mask Hyaluronic Acid & Orange Each,$5.00,$83.33 / 100G
Manicare Precision Tweezers Pink Each,$13.50,$13.50 / 1EA
No Issues Creme Clouds Luxurious Facial Tissues 3 Ply 90 Pack,$3.60,$6.00 / 100SS
Wet Ones Moist Wipes Be Fresh 80 Pack,$6.80,$0.09 / 1EA
Palmolive Foaming Liquid Hand Wash Soap Vanilla & Berry Refill 500ml,$4.00,$0.80 / 100ML
Simple Kind To Skin Facial Wash Moisturising 150ml,$8.00,$5.33 / 100ML
Neutrogena Beach Defence Spray Sunscreen Spf 50 184g,$20.00,$10.87 / 100G
Veet Hair Removal Cream Sensitive 100g,$7.00,$7.00 / 100G
Essentials Facial Tissues 224 Pack,$1.70,$0.76 / 100SS
Kleenex Everyday 2 Ply Facial Tissues 200 Pack,$3.00,$1.50 / 100SS
Quilton Facial Tissues Soft White 95 Pack,$1.40,$1.47 / 100SS
Kleenex Aloe Vera & Vitamin E 3 Ply Facial Tissues 95 Pack,$2.60,$2.74 / 100SS
Kleenex Aloe Vera & Vitamin E 3 Ply Facial Tissues 140 Pack,$3.60,$2.57 / 100SS
Symphony Facial Tissues White 228ss 3 Pack,$5.00,$0.73 / 100SS
Kleenex Large & Thick 3 Ply Facial Tissues 95 Pack,$2.80,$2.95 / 100SS
Swisspers Cotton Tips 240 Pack,$4.80,$2.00 / 100EA
Herbal Essences Bio:renew Argan Oil Of Morocco Repairing Shampoo 400ml,$13.50,$3.38 / 100ML
Oral-b Electric Toothbrush Precision Precision Clean Head 2 Pack,$16.00,$8.00 / 1EA
Nair Sensitive Wax Strips 40 Pack,$15.00,$0.38 / 1EA
U By Kotex Ultrathin Pads Regular With Wings 14 Pack,$3.50,$0.25 / 1EA
Sukin Natural Balance Conditioner 1l,$23.00,$2.30 / 100ML
Oral-b Sensitivity & Gum All Day Protection Fluoride Toothpaste 90g,$10.00,$11.11 / 100G
Sukin Blemish Control Clearing Facial Wash 125ml,$8.00,$6.40 / 100ML
Gillette Shaving Foam Sensitive Skin Value Pack 333g,$5.50,$1.65 / 100G
Oral-b 3d White Whitestrips Advanced Seal Whitening Treatments Each,$36.00,$2.57 / 1EA
Head & Shoulders Smooth & Silky Anti Dandruff Shampoo 660ml,$21.00,$3.18 / 100ML
Sensodyne Mouthwash Alcohol Free Cool Mint Gentle 500ml,$9.90,$1.98 / 100ML
Rexona Men Advanced Workout Anti Perspirant Aerosol Deodorant 220ml,$9.50,$4.32 / 100ML
Sukin Cleansing Hand Wash Refill 1l,$13.00,$1.30 / 100ML
Colgate 360 Advanced Bacteria Removing Action Soft Toothbrush Each,$6.00,$6.00 / 1EA
Cashmere Bouquet Talcum Powder With A Fresh Scent Of Lavender 250g,$4.00,$1.60 / 100G
Woolworths Everyday Sunscreen Sensitive Spray Spf50+ 200ml,$8.00,$4.00 / 100ML
Schwarzkopf Extra Care Ultimate Repair Strengthening Shampoo 400ml,$9.00,$2.25 / 100ML
Sukin Signature Cream Cleanser Pump 125ml,$7.50,$6.00 / 100ML
Vicks Vapodrop & Cough Sore Throat Lozenges Honey Lemon 36 Pack,$10.90,$0.30 / 1EA
Garnier Micellar Cleansing Wipes For All Skin Types 25 Pack,$8.00,$0.32 / 1EA
Colgate Slim Soft Advanced Ultra Soft Toothbrush Value 2 Pack,$10.00,$5.00 / 1EA
Rexona Men Antiperspirant Aerosol Deodorant Invisible Dry 220ml,$9.50,$4.32 / 100ML
Schwarzkopf Extra Care Liquid Silk Smoothing Shampoo 400ml,$9.00,$2.25 / 100ML
Dove Beauty Cream Bar Original Soap 90g X 6 Pack,$8.80,$1.63 / 100G
Essentials Facial Tissues 224 Pack,$1.70,$0.76 / 100SS
Kleenex Everyday 2 Ply Facial Tissues 200 Pack,$3.00,$1.50 / 100SS
Quilton Facial Tissues Soft White 95 Pack,$1.40,$1.47 / 100SS
Kleenex Aloe Vera & Vitamin E 3 Ply Facial Tissues 95 Pack,$2.60,$2.74 / 100SS
Kleenex Aloe Vera & Vitamin E 3 Ply Facial Tissues 140 Pack,$3.60,$2.57 / 100SS
Symphony Facial Tissues White 228ss 3 Pack,$5.00,$0.73 / 100SS
Kleenex Large & Thick 3 Ply Facial Tissues 95 Pack,$2.80,$2.95 / 100SS
Swisspers Cotton Tips 240 Pack,$4.80,$2.00 / 100EA
Band-aid Tough Strips Brand 40 Pack,$4.80,$0.12 / 1EA
My Soda Hydrate Conditioner 350ml,$10.00,$2.86 / 100ML
Strepsils Extra Honey And Lemon Sore Throat Fast Numb Lozenges 16 Pack,$9.00,$0.56 / 1EA
Tena Active Panty Liners Odour Control 30 Pack,$3.85,$0.13 / 1EA
Colgate Slim Soft Advanced Charcoal Bristles Ultra Soft Toothbrush 1 Pack,$6.00,$6.00 / 1EA
Natures Organics Turning Point 2-in-1 Normal 400ml,$3.00,$0.75 / 100ML
Sunsilk Clean & Fresh Conditioner 700ml,$12.00,$1.71 / 100ML
Tresemme Volume & Fullness Shampoo Multi-vitamins & Coconut Oil 940ml,$9.80,$1.04 / 100ML
T.n. Dickinson's Toners Witch Hazel 240ml,$10.00,$4.17 / 100ML
Elastoplast Rigid Strapping Tape For Prevention & Support 15m Each,$10.00,$10.00 / 1EA
Sukin Cleansing Hand Wash Bergamot & Patchouli Pump 500ml,$5.50,$1.10 / 100ML
Rexona Men Antiperspirant Aerosol Deodorant Quantum 250ml,$6.00,$2.40 / 100ML
Palmolive Antibacterial Liquid Hand Wash Soap White Tea Refill 1l,$7.00,$0.70 / 100ML
Colgate Bamboo Charcoal Biodegradable Toothbrush Bpa Free Medium 2 Pack,$10.00,$10.00 / 1EA
Schick Mens Razor Disposable Xtreme 3 Sensitive 4 Pack,$6.00,$1.50 / 1EA
Sunsilk Keratin Conditioner Defeat Damage 700ml,$12.00,$1.71 / 100ML
Dove Shampoo Daily Care With Lightweight Technology 320ml,$7.70,$2.41 / 100ML
Cancer Council Watersport Spf50+ Sunscreen Pump 500ml,$29.00,$5.80 / 100ML
Tena Insta Dry Pads Standard Length 20 Pack,$10.00,$0.50 / 1EA
Schwarzkopf Extra Care Marrakesh Oil & Coconut Replenishing Shampoo 950ml,$19.00,$2.00 / 100ML
Dove Body Wash Triple Moisturising Triple Moisturising 1l,$17.00,$1.70 / 100ML
Rexona Women Clinical Antiperspirant Deodorant Summer Strength 45ml,$14.00,$31.11 / 100ML
Palmolive Antibacterial Foaming Liquid Hand Wash Soap Refill Lime 500ml,$4.00,$0.80 / 100ML
Palmolive Antibacterial Liquid Hand Wash Soap Sea Minerals Refill 1l,$7.00,$0.70 / 100ML
Essentials Facial Tissues 224 Pack,$1.70,$0.76 / 100SS
Kleenex Everyday 2 Ply Facial Tissues 200 Pack,$3.00,$1.50 / 100SS
Quilton Facial Tissues Soft White 95 Pack,$1.40,$1.47 / 100SS
Kleenex Aloe Vera & Vitamin E 3 Ply Facial Tissues 95 Pack,$2.60,$2.74 / 100SS
Kleenex Aloe Vera & Vitamin E 3 Ply Facial Tissues 140 Pack,$3.60,$2.57 / 100SS
Symphony Facial Tissues White 228ss 3 Pack,$5.00,$0.73 / 100SS
Kleenex Large & Thick 3 Ply Facial Tissues 95 Pack,$2.80,$2.95 / 100SS
Swisspers Cotton Tips 240 Pack,$4.80,$2.00 / 100EA
Dove Cucumber Beauty Cream Soap Bar 4 Bars 360g,$4.50,$1.25 / 100G
L'oreal Elvive Colour Protecting Shampoo 300ml,$8.50,$2.83 / 100ML
Pantene Pro-v Classic Clean Shampoo 375ml,$5.00,$1.33 / 100ML
Gillette Venus Daisy Classic Disposable Razors 5 Pack,$5.50,$1.10 / 1EA
Banana Boat Spf 50+ Sunscreen Sport Spray 175g,$21.00,$12.00 / 100G
Rexona Women Advanced Protection Antiperspirant Bright Bouquet 220ml,$9.50,$4.32 / 100ML
Colgate 360 Optic White Battery Power Whitening Toothbrush Medium Each,$4.00,$4.00 / 1EA
Nivea Refreshing Facial Toner For Normal & Combination Skin 200ml,$7.80,$3.90 / 100ML
Sukin Sensitive Cleansing Gel 125ml,$7.50,$7.50 / 1EA
Mcobeauty Perfect Tweezers 4 Pack,$15.00,$15.00 / 1EA
Oc Naturals Conditioner Dry Nourish 725ml,$6.40,$0.88 / 100ML
Oral-b 3d White Enamel Strong Whitening Toothpaste 95g,$16.00,$16.84 / 100G
Rexona Women Advanced Protection Anti Perspirant Shower Fresh 220ml,$9.50,$4.32 / 100ML
Sundae Pomegranate Fizz Shower Foam 265ml,$13.40,$5.06 / 100ML
Vaseline Intensive Care Cocoa Glow Body Lotion 750ml,$16.00,$2.13 / 100ML
Vaseline Intensive Care Body Lotion Deep Restore 225ml,$6.50,$2.89 / 100ML
Jack N' Jill Natural Toothpaste Milkshake 50g,$7.50,$15.00 / 100G
Sundae Cherry On Top Shower Foam Kadadu Plum & Finger Lime 265ml,$13.40,$5.06 / 100ML
Thursday Plantation Oil Tea Tree 15ml,$6.50,$43.33 / 100ML
"Tresemme Colour Revitalise Shampoo Vit E, Agran Oil & Green Tea 940ml",$9.80,$1.04 / 100ML
Sambucol Soothing Throat Lozenges Black Elderberry 16 Pack,$8.00,$0.50 / 1EA
Sun Zapper Zinc Light Skin Tone Sunscreen 12g,$11.00,$91.67 / 100G
Essentials Facial Tissues 224 Pack,$1.70,$0.76 / 100SS
Kleenex Everyday 2 Ply Facial Tissues 200 Pack,$3.00,$1.50 / 100SS
Quilton Facial Tissues Soft White 95 Pack,$1.40,$1.47 / 100SS
Kleenex Aloe Vera & Vitamin E 3 Ply Facial Tissues 95 Pack,$2.60,$2.74 / 100SS
Kleenex Aloe Vera & Vitamin E 3 Ply Facial Tissues 140 Pack,$3.60,$2.57 / 100SS
Symphony Facial Tissues White 228ss 3 Pack,$5.00,$0.73 / 100SS
Kleenex Large & Thick 3 Ply Facial Tissues 95 Pack,$2.80,$2.95 / 100SS
Swisspers Cotton Tips 240 Pack,$4.80,$2.00 / 100EA
Mennen Lady Speed Stick Fresh Infusions Orchard Blossom 45g,$4.00,$8.89 / 100G
Gillette Venus Smooth Razor Blades 4 Pack,$17.50,$4.38 / 1EA
Nivea Sun Sensitive Protect Sunscreen Lotion Spf50 100ml,$14.00,$14.00 / 100ML
Schwarzkopf Extra Care Colour Perfector Protecting Shampoo 400ml,$9.00,$2.25 / 100ML
Tena Pants For Women Large 8 Pack,$14.30,$1.79 / 1EA
Tena Liners Ultra Long 22 Pack,$3.85,$0.18 / 1EA
Strepsils Sore Throat Sugar Free Lemon Lozenges 36 Pack,$12.00,$0.33 / 1EA
Banana Boat Kids Sunscreen Roll On 50+ 75ml,$12.50,$16.67 / 100ML
Sanofi Shave Cream Moisturising Shaving Cream 75g,$2.65,$3.53 / 100G
Simple Kind To Skin Micellar Water Wipes Biodegradable 20 Pack,$4.90,$0.25 / 1EA
Herbal Essences Bio:renew Argan Oil Of Morocco Repairing Shampoo 600ml,$19.00,$3.17 / 100ML
Sukin Signature Cleansing Hand Wash 500ml,$5.50,$1.10 / 100ML
Libra Ultra Thins Sanitary Pads Thin Regular 14 Pack,$3.50,$0.25 / 1EA
Sukin Rosehip Rejuvenating Facial Scrub 125ml,$8.00,$6.40 / 100ML
Simple Cleanser Vital Vitamin Foaming 150ml,$10.00,$6.67 / 100ML
Sukin Signature Moisture Restoring Night Cream 120ml,$11.00,$9.17 / 100ML
The Wiggles Toothpaste Strawberry Flavour Sugar Free 2-5 Years 96g,$2.80,$2.92 / 100G
Cancer Council Moisture Sunscreen Spf 50+ 110ml,$14.00,$12.73 / 100ML
Rexona Women Antiperspirant Aerosol Antibacterial Protection 250ml,$6.00,$2.40 / 100ML
Sundae Coconut Foam Whipped Shower Foam With Plum & Lime 265ml,$13.40,$5.06 / 100ML
Panadol Rapid For Pain Relief Paracetamol 500 Mg 20 Pack,$6.00,$0.30 / 1EA
Sambucol Cold & Flu Forte Plus Vit C & Zinc Capsules 24 Pack,$15.20,$0.63 / 1EA
Redwin Sorbolene Daily Moisturiser 550ml,$4.80,$0.87 / 100ML
Schwarzkopf Extra Care Push Up Volume Lifting Shampoo 400ml,$9.00,$2.25 / 100ML
Essentials Facial Tissues 224 Pack,$1.70,$0.76 / 100SS
Kleenex Everyday 2 Ply Facial Tissues 200 Pack,$3.00,$1.50 / 100SS
Quilton Facial Tissues Soft White 95 Pack,$1.40,$1.47 / 100SS
Kleenex Aloe Vera & Vitamin E 3 Ply Facial Tissues 95 Pack,$2.60,$2.74 / 100SS
Kleenex Aloe Vera & Vitamin E 3 Ply Facial Tissues 140 Pack,$3.60,$2.57 / 100SS
Symphony Facial Tissues White 228ss 3 Pack,$5.00,$0.73 / 100SS
Kleenex Large & Thick 3 Ply Facial Tissues 95 Pack,$2.80,$2.95 / 100SS
Swisspers Cotton Tips 240 Pack,$4.80,$2.00 / 100EA
Veet Pure Cold Wax Strips Legs & Body 40 Pack,$15.20,$0.38 / 1EA
Neutrogena Ultra Sheer Face Lotion Sunscreen Spf 50 88ml,$18.00,$20.45 / 100ML
Tresemme Nourish & Shine Shampoo With Vitamin E & Hemp Seed Oil 940ml,$9.80,$1.04 / 100ML
Sambucol Kids Immunity Gummies 50 Pack,$11.65,$0.23 / 1EA
Vicks Vapodrop & Cough Sore Throat Lozenges Honey Lemon 16 Pack,$6.50,$0.41 / 1EA
No Issues Facial Tissues Pocket Pack 6 Pack,$2.70,$4.50 / 100SS
Palmolive Luminous Oils Coconut Oil & Frangipani Conditioner 350ml,$4.80,$1.37 / 100ML
Grants Of Australia Fresh Mint Natural Toothpaste With Fluoride 110g,$4.50,$4.09 / 100G
Sukin Botanical Body Wash Bergamot & Patchouli 500ml,$5.50,$1.10 / 100ML
Tena Mini Plus Pads 16 Pack,$4.40,$0.28 / 1EA
Banana Boat Spf 50+ Sunscreen Sport 400g,$24.00,$6.00 / 100G
Nivea Sun Sensitive Protect Sunscreen Lotion Spf50 200ml,$20.00,$10.00 / 100ML
Gillette Venus Comfortglide White Tea Razor Blades 4 Pack,$23.50,$5.88 / 1EA
Strepsils Herbal Cough Blocked Nose Sore Throat Lozenges Honey Lemon 16 Pack,$8.00,$0.50 / 1EA
U By Kotex Ultrathin Pads Super With Wings 12 Pack,$3.50,$0.29 / 1EA
Schwarzkopf Extra Care Ultimate Repair Strengthening Shampoo 950ml,$19.00,$2.00 / 100ML
Libra Ultra Thins Pads Wings Regular 14 Pack,$3.50,$0.25 / 1EA
Sukin Hydrating Shampoo 1l,$23.00,$2.30 / 100ML
Oral-b Sensitivity & Gum Extra Fresh Breath Toothpaste Soft Mint 90g,$10.00,$11.11 / 100G
Red Seal Strong Mint Toothpaste 100g,$3.60,$3.60 / 100G
Palmolive Naturals Intensive Moisture Hair Conditioner Coco & Milk 700ml,$7.00,$1.00 / 100ML
Gillette Venus Satin Care Shaving Gel Sensitive Skin 195g,$8.00,$4.10 / 100G
Palmolive Naturals Anti-dandruff 2in1 Shampoo & Hair Conditioner 350ml,$6.00,$1.71 / 100ML
Essentials Facial Tissues 224 Pack,$1.70,$0.76 / 100SS
Kleenex Everyday 2 Ply Facial Tissues 200 Pack,$3.00,$1.50 / 100SS
Quilton Facial Tissues Soft White 95 Pack,$1.40,$1.47 / 100SS
Kleenex Aloe Vera & Vitamin E 3 Ply Facial Tissues 95 Pack,$2.60,$2.74 / 100SS
Kleenex Aloe Vera & Vitamin E 3 Ply Facial Tissues 140 Pack,$3.60,$2.57 / 100SS
Symphony Facial Tissues White 228ss 3 Pack,$5.00,$0.73 / 100SS
Kleenex Large & Thick 3 Ply Facial Tissues 95 Pack,$2.80,$2.95 / 100SS
Swisspers Cotton Tips 240 Pack,$4.80,$2.00 / 100EA
Sukin Sensitive Facial Moisturiser Pump 125ml,$7.50,$6.00 / 100ML
Sudafed Pe Sinus + Pain Relief 20 Pack,$14.00,$0.70 / 1EA
Sukin Botanical Body Wash Ylang Ylang & Cedar 500ml,$5.50,$1.10 / 100ML
Banana Boat Spf 50+ Sunscreen Sport 200g,$19.00,$9.50 / 100G
Pantene Daily Moisture Renewal Conditioner 90ml,$3.00,$3.33 / 100ML
Vicks Vapo Naturals Honey Drops 19 Pack,$4.40,$0.23 / 1EA
Sukin Signature Botanical Body Wash 500ml,$5.50,$1.10 / 100ML
Surf Life Saving Sunscreen Sport Spray Spf 50+ 175g,$19.00,$10.86 / 100G
Voeu Clarifying Exfoliating Scrub 150ml,$5.50,$3.67 / 100ML
My Soda Smooth Shampoo Refill 500ml,$12.00,$2.40 / 100ML
Palmolive Naturals Smooth & Shine Shampoo Keratin & Argan Oil 700ml,$7.00,$1.00 / 100ML
Rexona Men Antiperspirant Aerosol Deodorant Spray Ice Cool 250ml,$6.00,$2.40 / 100ML
Invisible Zinc Sport Spf 50+ Mineral Sunscreen Cream 100g,$29.00,$29.00 / 100ML
Voltaren 12 Hourly Osteo Gel 100g,$32.00,$32.00 / 100G
Schwarzkopf Extra Care Ultimate Repair Strengthening Conditioner 400ml,$9.00,$2.25 / 100ML
Balnea Cleansing Puff Assorted Each,$2.20,$2.20 / 1EA
Telfast Hayfever Allergy Relief 60mg Antihistamine Tablets 10 Pack,$7.35,$0.74 / 1EA
Original Source Body Wash Creamy Vanilla & Raspberry Shower Gel 250ml,$5.00,$2.00 / 100ML
Vaseline Intensive Care Body Lotion Aloe Soothe 225ml,$6.50,$2.89 / 100ML
Herbal Essences Bio:renew Coconut Milk Hydrating Shampoo 600ml,$19.00,$3.17 / 100ML
Dettol Antibacterial Liquid Hand Wash Pump Aloe Vera And Vitamin E 250ml,$2.80,$1.12 / 100ML
Oral-b Dental Floss Satin Tape Mint 25 Meters Each,$3.20,$0.13 / 1M
Strepsils Extra Blackcurrant Fast Numbing Pain Relief Lozenges 36 Pack,$17.00,$17.00 / 1EA
Essentials Facial Tissues 224 Pack,$1.70,$0.76 / 100SS
