Product Name,Price,Price per Unit
Fairy Platinum Plus Expert All In One Dishwasher Tablets 28 Pack,$47.00,$1.68 / 1EA
Fairy Platinum All In One Lemon Automatic Dishwasher Tablets 20 Pack,$15.60,$0.78 / 1EA
Fairy Platinum All In One Lemon Automatic Dishwasher Tablets 52 Pack,$33.60,$0.65 / 1EA
Fairy Original All In One Lemon Automatic Dishwasher Tablets 26 Pack,$13.50,$0.52 / 1EA
Essentials Facial Tissues 224 Pack,$1.70,$0.76 / 100SS
Kleenex Everyday 2 Ply Facial Tissues 200 Pack,$3.00,$1.50 / 100SS
Quilton Facial Tissues Soft White 95 Pack,$1.40,$1.47 / 100SS
Kleenex Aloe Vera & Vitamin E 3 Ply Facial Tissues 140 Pack,$3.60,$2.57 / 100SS
Quilton 2ply Tissue Hypo-allergenic 250 Pack,$2.90,$1.16 / 100SS
Quilton Gold 4 Ply Tissues Aloe Vera 100 Pack,$2.20,$2.20 / 100SS
Fairy Platinum All In One Lemon Automatic Dishwasher Tablets 41 Pack,$47.00,$1.15 / 1EA
Fairy Original All In One Lemon Automatic Dishwasher Tablets 48 Pack,$22.00,$0.46 / 1EA
Dynamo Professional 7 In 1 Laundry Detergent Capsules 14 Pack,$18.00,$1.29 / 1EA
Dynamo Professional 7 In 1 Laundry Detergent Capsules 28 Pack,$32.00,$1.14 / 1EA
Kleenex Eucalyptus 3 Ply Facial Tissues 95 Pack,$2.60,$2.74 / 100SS
Sorbent Facial Tissues Thick & Large White 95 Pack,$2.20,$2.32 / 100SS
Strike Disinfectant Wipes Lemon 100 Pack,$4.00,$0.04 / 1EA
Kleenex Aloe Vera & Vitamin E 3 Ply Facial Tissues 95 Pack,$2.60,$2.74 / 100SS
Symphony Facial Tissues White 228ss 3 Pack,$5.00,$0.73 / 100SS
Kleenex Large & Thick 3 Ply Facial Tissues 95 Pack,$2.80,$2.95 / 100SS
Kleenex Complete Clean Toilet Paper 24 Pack,$13.50,$0.31 / 100SS
Quilton Toilet Tissue 3 Ply White 180 Sheets 24 Pack,$13.60,$0.31 / 100SS
Essentials Sponge Scourer 6 Pack,$2.50,$0.42 / 1EA
Quilton Facial Tissue White 3ply 55ss White 3ply Each,$2.30,$4.18 / 100SS
Sorbent Toilet Tissue White 10 Pack,$6.00,$0.33 / 100SS
Kleenex Eucalyptus 3 Ply Facial Tissues 140 Pack,$3.60,$2.57 / 100SS
Kleenex Soft & Thick 3 Ply Facial Tissues 95 Pack,$2.70,$2.84 / 100SS
Sorbent Toilet Tissue White 20 Pack,$10.90,$0.30 / 100SS
Vevelle Toilet Tissue 3ply 190 Sheet 24 Pack,$11.90,$0.26 / 100SS
Strike Disinfectant Wipes Apple 100 Pack,$4.00,$0.04 / 1EA
Essentials Household Sponge 5 Pack,$1.60,$0.32 / 1EA
Windex Glass Cleaner Trigger 500ml,$4.80,$0.96 / 100ML
Fairy Platinum Plus Expert All In One Dishwasher Tablets 28 Pack,$47.00,$1.68 / 1EA
Fairy Platinum All In One Lemon Automatic Dishwasher Tablets 20 Pack,$15.60,$0.78 / 1EA
Fairy Platinum All In One Lemon Automatic Dishwasher Tablets 52 Pack,$33.60,$0.65 / 1EA
Fairy Original All In One Lemon Automatic Dishwasher Tablets 26 Pack,$13.50,$0.52 / 1EA
Essentials Facial Tissues 224 Pack,$1.70,$0.76 / 100SS
Kleenex Everyday 2 Ply Facial Tissues 200 Pack,$3.00,$1.50 / 100SS
Quilton Facial Tissues Soft White 95 Pack,$1.40,$1.47 / 100SS
Kleenex Aloe Vera & Vitamin E 3 Ply Facial Tissues 140 Pack,$3.60,$2.57 / 100SS
Quilton 2ply Tissue Hypo-allergenic 250 Pack,$2.90,$1.16 / 100SS
Quilton Gold 4 Ply Tissues Aloe Vera 100 Pack,$2.20,$2.20 / 100SS
Fairy Platinum All In One Lemon Automatic Dishwasher Tablets 41 Pack,$47.00,$1.15 / 1EA
Fairy Original All In One Lemon Automatic Dishwasher Tablets 48 Pack,$22.00,$0.46 / 1EA
Dynamo Professional 7 In 1 Laundry Detergent Capsules 14 Pack,$18.00,$1.29 / 1EA
Dynamo Professional 7 In 1 Laundry Detergent Capsules 28 Pack,$32.00,$1.14 / 1EA
Kleenex Eucalyptus 3 Ply Facial Tissues 95 Pack,$2.60,$2.74 / 100SS
Sorbent Facial Tissues Thick & Large White 95 Pack,$2.20,$2.32 / 100SS
Strike Disinfectant Wipes Lemon 100 Pack,$4.00,$0.04 / 1EA
Kleenex Aloe Vera & Vitamin E 3 Ply Facial Tissues 95 Pack,$2.60,$2.74 / 100SS
Symphony Facial Tissues White 228ss 3 Pack,$5.00,$0.73 / 100SS
Kleenex Large & Thick 3 Ply Facial Tissues 95 Pack,$2.80,$2.95 / 100SS
Kleenex Complete Clean Toilet Paper 24 Pack,$13.50,$0.31 / 100SS
Quilton Toilet Tissue 3 Ply White 180 Sheets 24 Pack,$13.60,$0.31 / 100SS
Essentials Sponge Scourer 6 Pack,$2.50,$0.42 / 1EA
Quilton Facial Tissue White 3ply 55ss White 3ply Each,$2.30,$4.18 / 100SS
Sorbent Toilet Tissue White 10 Pack,$6.00,$0.33 / 100SS
Kleenex Eucalyptus 3 Ply Facial Tissues 140 Pack,$3.60,$2.57 / 100SS
Kleenex Soft & Thick 3 Ply Facial Tissues 95 Pack,$2.70,$2.84 / 100SS
Sorbent Toilet Tissue White 20 Pack,$10.90,$0.30 / 100SS
Vevelle Toilet Tissue 3ply 190 Sheet 24 Pack,$11.90,$0.26 / 100SS
Strike Disinfectant Wipes Apple 100 Pack,$4.00,$0.04 / 1EA
Essentials Household Sponge 5 Pack,$1.60,$0.32 / 1EA
Windex Glass Cleaner Trigger 500ml,$4.80,$0.96 / 100ML
Sorbent Hypo-allergenic Pure White Tissues 170 Pack,$2.00,$1.18 / 100SS
Earth Choice Wool Wash 1l,$2.60,$2.60 / 1L
Quilton Classic Toilet Tissue 3 Ply 8 Pack,$8.60,$0.60 / 100SS
Essentials Stainless Steel Scourer 3 Pack,$0.89,$0.30 / 1EA
Viva Paper Towels 180 Sheets 3 Pack,$5.50,$3.06 / 100SS
Quilton Double Length Toilet Tissue 3ply White 360 Sheets 8 Pack,$12.00,$0.42 / 100SS
Kleenex Aloe Vera & Vitamin E 3 Ply Large & Thick Facial Tissues 70 Pack,$2.60,$3.71 / 100SS
Essentials Non-scratch Sponge Scourers Scourers 3 Pack,$1.99,$0.66 / 1EA
Essentials Scourer 6 Pack,$0.70,$0.12 / 1EA
Sorbent Flushable Wipes Hypo-allergenic 40 Pack,$3.00,$0.08 / 1EA
Sorbent Flushable Wipes Clean & Fresh Refill 40 Pack,$3.00,$0.08 / 1EA
Essentials Heavy Duty Sponge Scourers 3 Pack,$1.99,$0.66 / 1EA
Sorbent Toilet Tissue Hypo Allergenic 20 Pack,$10.90,$0.30 / 100SS
Essentials Wipes Domestic 10 Pack,$0.99,$0.10 / 1EA
Kleenex Everyday Kids 2 Ply Facial Tissues 200 Pack,$3.00,$1.50 / 100SS
Sard Super Power Stain Remover Spray 420ml,$8.00,$1.90 / 100ML
Vanish Preen Gold Fabric Stain Remover Spray 450ml,$7.50,$16.67 / 1L
Vevelle 2 Ply White Toilet Tissue 12 Pack,$5.30,$0.17 / 100SS
Handee Ultra Paper Towel White 2 Ply 180 Sheets 3 Pack,$3.50,$1.94 / 100SS
Kleenex Aloe Vera & Vitamin E 3 Ply Facial Tissues Cube 60 Pack,$3.00,$5.00 / 100SS
Essentials Non-scratch Sponge Scourer 5 Pack,$4.00,$0.80 / 1EA
Chux Heavy Duty Scourer Scrubs 4 Pack,$5.70,$1.43 / 1EA
Scotch-brite Handy Sponge 4ea,$4.30,$1.08 / 1EA
Kleenex Complete Clean Toilet Paper 24 Pack,$13.50,$0.31 / 100SS
Quilton Toilet Tissue 3 Ply White 180 Sheets 24 Pack,$13.60,$0.31 / 100SS
Quilton Double Length Toilet Tissue 3ply White 360 Sheets 8 Pack,$12.00,$0.42 / 100SS
Sorbent Toilet Tissue White 20 Pack,$10.90,$0.30 / 100SS
Finish Ultimate Pro Dishwasher Tablets Lemon 46 Pack,$54.00,$1.17 / 1EA
Quilton Classic Toilet Tissue 3 Ply 8 Pack,$8.60,$0.60 / 100SS
Viva Paper Towels 180 Sheets 3 Pack,$5.50,$3.06 / 100SS
Sorbent Toilet Tissue White 10 Pack,$6.00,$0.33 / 100SS
Sorbent Facial Tissues 4ply Pocket Pack 6 Pack,$2.20,$3.67 / 100SS
Windex Surface & Glass Multi-purpose Cleaner Floral 750ml,$2.85,$0.38 / 100ML
Chux Non Scratch Scourer Scrubs 8 Pack,$6.50,$0.81 / 1EA
Edco Jumbo Thick Sponges 3 Pack,$3.30,$1.10 / 1EA
Woolworths Essentials Household Grade Disinfectant Wipes Fresh 120 Pack,$2.50,$0.02 / 1EA
Quilton Toilet Tissue 3 Ply Prints 180 Sheets 24 Pack,$13.60,$0.31 / 100SS
Quilton Double Length Toilet Tissue 3 Ply Prints 360 Sheets 8 Pack,$12.00,$0.42 / 100SS
Selleys Sugar Soap Liquid 750ml,$4.60,$0.61 / 100ML
Sard Super Power Stain Remover Powder Soaker 900g,$5.50,$6.11 / 1KG
Aloe Vera Tissues 3ply 95 Pack,$2.00,$2.11 / 100SS
Quilton Toilet Tissue King Size Unscented 6 Pack,$5.80,$0.55 / 100SS
Scotch-brite Non Scratch Scrub Sponge 3 Pack,$5.00,$1.67 / 1EA
Sorbent Clean & Fresh Wipes 80 Pack,$7.00,$0.09 / 1EA
Windex Glass Cleaner Refill Refill 750ml,$4.80,$0.64 / 100ML
Viva Paper Towels White 360 Sheets 6 Pack,$9.00,$2.50 / 100SS
Lectric Inwash & Soaker Washing Soda 1kg,$5.00,$5.00 / 1KG
Vanish Preen Everyday Fabric Stain Remover Spray 375ml,$7.00,$18.67 / 1L
Quilton Gold Toilet Paper 12 Pack,$10.30,$0.61 / 100SS
Viva Select-a-size Paper Towels White 270 Sheets 3 Pack,$5.50,$2.04 / 100SS
Chux Non Scratch Scourer Scrubs 4 Pack,$5.70,$1.43 / 1EA
Edco Stainless Steel Scourer 2 Pack,$2.00,$1.00 / 1EA
Sard Power Stain Remover Powder Soaker 1kg,$5.50,$5.50 / 1KG
Softly Delicates Fabric Solution 1.25l,$9.00,$7.20 / 1L
Icare 100% Recycled Toilet Tissue Double Length White 3 Ply 6 Pack,$6.00,$0.28 / 100SS
Kleenex Complete Clean Toilet Paper 24 Pack,$13.50,$0.31 / 100SS
Quilton Toilet Tissue 3 Ply White 180 Sheets 24 Pack,$13.60,$0.31 / 100SS
Quilton Double Length Toilet Tissue 3ply White 360 Sheets 8 Pack,$12.00,$0.42 / 100SS
Sorbent Toilet Tissue White 20 Pack,$10.90,$0.30 / 100SS
Finish Ultimate Pro Dishwasher Tablets Lemon 46 Pack,$54.00,$1.17 / 1EA
Quilton Classic Toilet Tissue 3 Ply 8 Pack,$8.60,$0.60 / 100SS
Viva Paper Towels 180 Sheets 3 Pack,$5.50,$3.06 / 100SS
Sorbent Toilet Tissue White 10 Pack,$6.00,$0.33 / 100SS
Icare 100% Recycled Toilet Tissue 3 Ply 180 Sheets 24 Pack,$13.50,$0.31 / 100SS
Chux Heavy Duty Scourer Scrubs 8 Pack,$6.50,$0.81 / 1EA
Essentials Domestic Wipes 50 Pack,$4.50,$0.09 / 1EA
Sard Power Stain Remover Spray 450ml,$8.00,$1.78 / 100ML
Vanish Napisan Stain Remover Powder 1kg,$11.50,$11.50 / 1KG
Sorbent Vanilla Fragrance Collection Facial Tissues 170 Pack,$2.00,$1.18 / 100SS
Kleenex Complete Clean Toilet Paper Toilet Tissue 9 Pack,$9.00,$0.56 / 100SS
Strike Disinfectant Spray Eucalyptus 300g,$4.00,$1.33 / 100G
Sard Super Power Stain Remover Refill 420ml,$6.00,$14.29 / 1L
Essentials Sponge Cloth 3 Pack,$0.99,$0.33 / 1EA
Sorbent Flushable Wipes Kids 40 Pack,$4.00,$0.10 / 1EA
Surf Washing Liquid Tropical Lily 40 Washes 2 L,$9.00,$4.50 / 1L
Sard Wonder Soap Stain Remover Eucalyptus 125g,$4.00,$32.00 / 1KG
Kleenex Everyday 2 Ply Facial Tissues 250 Pack,$4.00,$1.60 / 100SS
Quilton Tuffy Paper Towel White 4 Ply 180 Sheets 3 Pack,$5.00,$2.78 / 100SS
Essentials Wipes Domestic 30 Pack,$2.90,$0.10 / 1EA
Dishmatic General Purpose Refill 3 Pack,$6.30,$2.10 / 1EA
Icare Everyday Facial Tissue 200 Pack,$2.00,$1.00 / 100SS
No Issues Facial Tissues Single Cube 60 Sheets,$2.00,$3.33 / 100SS
Kleenex Aloe Vera & Vitamin E 4 Ply Pocket Pack Facial Tissues 6 Pack,$3.70,$6.85 / 100SS
Sard Stain Remover Stick Each,$6.00,$60.00 / 1KG
Kleenex Complete Clean Double Length Toilet Paper 12 Pack,$13.50,$0.31 / 100SS
Strike Paper Towels Embossed 2 Ply 2 Pack,$1.90,$1.19 / 100SS
Sard Oils & Grime Stain Remover Spray 420ml,$8.00,$19.05 / 1L
Kleenex Complete Clean Toilet Paper 24 Pack,$13.50,$0.31 / 100SS
Quilton Toilet Tissue 3 Ply White 180 Sheets 24 Pack,$13.60,$0.31 / 100SS
Quilton Double Length Toilet Tissue 3ply White 360 Sheets 8 Pack,$12.00,$0.42 / 100SS
Sorbent Toilet Tissue White 20 Pack,$10.90,$0.30 / 100SS
Finish Ultimate Pro Dishwasher Tablets Lemon 46 Pack,$54.00,$1.17 / 1EA
Quilton Classic Toilet Tissue 3 Ply 8 Pack,$8.60,$0.60 / 100SS
Viva Paper Towels 180 Sheets 3 Pack,$5.50,$3.06 / 100SS
Sorbent Toilet Tissue White 10 Pack,$6.00,$0.33 / 100SS
Sard Super Power Stain Remover Powder Soaker 1.8kg,$14.40,$8.00 / 1KG
Ajax Spray N' Wipe Multipurpose Antibacterial Cleaner Lemon 500ml,$3.50,$0.70 / 100ML
Scotch-brite Heavy Duty Scourer & Sponge 3 Pack,$5.00,$1.67 / 1EA
Vanish Gold Oxi Advance 2kg,$22.40,$11.20 / 1KG
Strike Aerosol Disinfectant Hospital Grade Marine Fresh 300g,$4.00,$1.33 / 100G
Vileda Wettex Cleaning Cloth Super Absorbent Assorted 3 Pack,$4.70,$1.57 / 1EA
Vanish Napisan Stain Remover Powder 2kg,$19.00,$9.50 / 1KG
Shine Dish Brush Each,$1.75,$1.75 / 1EA
Global Good Collective Bamboo Toilet Tissue Rolls 3 Ply 180 Sheets 6 Pack,$5.00,$0.46 / 100SS
Quilton Pocket Packs 4ply Hypo Allergenic 6 Pack,$2.40,$4.00 / 100SS
Wet Ones Moist Wipes Gentle 15 Pack,$2.20,$0.15 / 1EA
Kleenex Flushable Wipes Unscented 42 Pack,$3.95,$0.09 / 1EA
Windex Shower Cleaner Spray Trigger 750ml,$5.90,$0.79 / 100ML
Ajax Eco Antibacterial Disinfectant Cleaning Wipes Lemon 110 Pack,$5.50,$0.05 / 1EA
Steelo Soap Pads 10 Pack,$6.00,$0.60 / 1EA
Surf Washing Liquid Coastal Luxury 40 Washes 2 L,$9.00,$4.50 / 1L
Softly Woolwash Laundry Wash Eucalyptus 1.25l,$9.00,$7.20 / 1L
Quilton Tuffy Paper Towel Triple Length White 360 Sheets 2 Pack,$8.00,$2.22 / 100SS
Armada Resealable Snack Bags 50 Pack,$1.60,$0.03 / 1EA
Windex Surface & Glass Wipes Wipes 28 Pack,$5.00,$0.18 / 1EA
Quilton Cooling Lotion 3 Ply Facial Tissue 95 Pack,$2.80,$2.95 / 100SS
Armada Large Kitchen Tidy Bag Lavender/lemon Scented 25 Pack,$2.50,$0.10 / 1EA
Vileda Handi Dish Brush Refills 4 Pack,$6.40,$1.60 / 1EA
Ajax Spray N Wipe Divine Blends Cleaner Trigger 475ml,$3.50,$0.74 / 100ML
Kleenex Complete Clean Toilet Paper 24 Pack,$13.50,$0.31 / 100SS
Quilton Toilet Tissue 3 Ply White 180 Sheets 24 Pack,$13.60,$0.31 / 100SS
Quilton Double Length Toilet Tissue 3ply White 360 Sheets 8 Pack,$12.00,$0.42 / 100SS
Sorbent Toilet Tissue White 20 Pack,$10.90,$0.30 / 100SS
Finish Ultimate Pro Dishwasher Tablets Lemon 46 Pack,$54.00,$1.17 / 1EA
Quilton Classic Toilet Tissue 3 Ply 8 Pack,$8.60,$0.60 / 100SS
Viva Paper Towels 180 Sheets 3 Pack,$5.50,$3.06 / 100SS
Sorbent Toilet Tissue White 10 Pack,$6.00,$0.33 / 100SS
