Product Name,Price,Price per Unit
Kleenex Everyday 2 Ply Facial Tissues 200 Pack,$3.00,$1.50 / 100SS
Quilton Facial Tissues Soft White 95 Pack,$1.40,$1.47 / 100SS
Kleenex Aloe Vera & Vitamin E 3 Ply Facial Tissues 95 Pack,$2.60,$2.74 / 100SS
Kleenex Aloe Vera & Vitamin E 3 Ply Facial Tissues 140 Pack,$3.60,$2.57 / 100SS
Symphony Facial Tissues White 228ss 3 Pack,$5.00,$0.73 / 100SS
Kleenex Large & Thick 3 Ply Facial Tissues 95 Pack,$2.80,$2.95 / 100SS
Swisspers Cotton Tips 240 Pack,$4.80,$2.00 / 100EA
Oral-b Cross Action Charcoal Manual Toothbrush Each,$6.00,$6.00 / 1EA
Vo5 Groomed Wax Styling 75ml,$6.00,$8.00 / 100ML
Anihana Shower Steamer Mint Refresher With Peppermint & Eucalyptus 50g,$5.00,$10.00 / 100G
Banana Boat Kids Sunscreen Spf 50+ 400g,$24.00,$6.00 / 100G
Banana Boat Spf 50+ Sunscreen Sensitive 200g,$19.00,$9.50 / 100G
"Tresemme Colour Revitalise Conditioner Vit E, Agran Oil & Green Tea 940ml",$9.80,$1.04 / 100ML
Sambucol Kids Throat Pops 8 Pack,$9.00,$1.13 / 1EA
Tena Men Level 2 10 Pack,$8.80,$0.88 / 1EA
Essentials Paracetamol 500mg Tablets 20 Pack,$0.80,$0.04 / 1EA
Nivea Refreshing Biodegradable Face Cleansing Makeup Wipes 25 Pack,$5.10,$0.20 / 1EA
Schwarzkopf Extra Care Liquid Silk Smoothing Conditioner 400ml,$9.00,$2.25 / 100ML
Garnier Fructis Normal Strength & Shine Conditioner 315ml,$5.60,$1.78 / 100ML
Nivea Sun Ultra Sport Cooling Trigger Sunscreen Spray Spf50+ 300ml,$26.00,$8.67 / 100ML
Sukin Green Tea Hydrating Mist Toner 125ml,$7.00,$5.60 / 100ML
Bondi Sands Self Tan Foam Dark 200ml,$15.40,$7.70 / 100ML
Oral-b Electric Toothbrush Sensitive Toothbrush Replacement Heads 2 Pack,$16.00,$8.00 / 1EA
Thursday Plantation Deodorant Roll On Teatree 60ml,$5.00,$8.33 / 100ML
Veet Hair Removal Cream Sensitive Skin 400ml,$16.80,$4.20 / 100ML
Bic Flex 2 Hybrid Shaver 10 Pack,$10.50,$1.05 / 1EA
Palmolive Kids Shampoo Conditioner And Body Wash Strawberry Trolls 700ml,$7.00,$1.00 / 100ML
Original Source Body Wash Tingly Mint & Tea Tree Shower Gel 250ml,$5.00,$2.00 / 100ML
Rennie Indigestion & Heartburn Relief Spearmint Chewable Tablets 48 Pack,$10.00,$0.21 / 1EA
Palmolive Naturals Body Wash Milk & Honey Shower Gel 1l,$10.00,$1.00 / 100ML
Schwarzkopf Extra Care Marrakesh Oil & Coconut Conditioner 400ml,$9.00,$2.25 / 100ML
Essentials Facial Tissues 224 Pack,$1.70,$0.76 / 100SS
Kleenex Everyday 2 Ply Facial Tissues 200 Pack,$3.00,$1.50 / 100SS
Quilton Facial Tissues Soft White 95 Pack,$1.40,$1.47 / 100SS
Kleenex Aloe Vera & Vitamin E 3 Ply Facial Tissues 95 Pack,$2.60,$2.74 / 100SS
Kleenex Aloe Vera & Vitamin E 3 Ply Facial Tissues 140 Pack,$3.60,$2.57 / 100SS
Symphony Facial Tissues White 228ss 3 Pack,$5.00,$0.73 / 100SS
Kleenex Large & Thick 3 Ply Facial Tissues 95 Pack,$2.80,$2.95 / 100SS
Swisspers Cotton Tips 240 Pack,$4.80,$2.00 / 100EA
Garnier Fructis Full & Luscious Shampoo 315ml,$5.60,$1.78 / 100ML
My Soda Smooth Shampoo 350ml,$10.00,$2.86 / 100ML
Help@hand Make Up Pads 80 Pack,$1.50,$1.88 / 100EA
Sukin Hydrating Conditioner 1l,$23.00,$2.30 / 100ML
Radox Bath Salt Muscle Soothe 500g,$8.25,$1.65 / 100G
Balnea Refreshing Lime Zest Anti Bacterial Hand Wash Refill 1l,$3.50,$0.35 / 100ML
Head & Shoulders Dry Scalp Care Anti Dandruff Shampoo For Dry Scalp 660ml,$21.00,$3.18 / 100ML
Pantene Pro-v Daily Moisture Renewal Conditioner 375ml,$5.00,$1.33 / 100ML
Swisspers Cotton Balls Extra Large 100 Pack,$4.10,$4.10 / 100EA
Rexona Women Clinical Antiperspirant Aerosol Summer Strength 180ml,$12.00,$6.67 / 100ML
My Soda Hydrate Shampoo Refill 500ml,$6.00,$1.20 / 100ML
Sukin Purely Ageless Restorative Night Cream 120ml,$15.00,$12.50 / 100ML
Nivea Sensitive Biodegradable Face Cleansing Makeup Wipes 25 Pack,$5.10,$0.20 / 1EA
Vaseline Expert Care Dry Skin Rescue Advanced Strength Body Lotion 550ml,$15.00,$2.73 / 100ML
Marzena Natural Facial Wax Strips 20 Pack,$9.00,$0.45 / 1EA
Schick Intuition Razor Pure Nourish Cartridges 3 Pack,$15.50,$5.17 / 1EA
Cancer Council Face Day Wear Moisturiser Matte Invisible Spf 50+ 75ml,$14.50,$19.33 / 100ML
Surf Life Saving Spf50+ Daily Sunscreen 1l,$29.00,$2.90 / 100ML
Vicks Vapodrop & Cough Sore Throat Lozenges Immune Orange 36 Pack,$15.90,$0.44 / 1EA
Anihana Shower Steamer Lavender Love With Lavender Essential Oil 50g,$5.00,$10.00 / 100G
Essentials Ibuprofen 200mg Tablets 24 Pack,$1.55,$0.06 / 1EA
Pantene Pro-v Colour Protection Shampoo For Coloured Hair 900ml,$10.00,$1.11 / 100ML
Oral B Complete 5 Way Clean Toothbrush Soft 3 Pack,$10.00,$3.33 / 1EA
Essentials Facial Tissues 224 Pack,$1.70,$0.76 / 100SS
Kleenex Everyday 2 Ply Facial Tissues 200 Pack,$3.00,$1.50 / 100SS
Quilton Facial Tissues Soft White 95 Pack,$1.40,$1.47 / 100SS
Kleenex Aloe Vera & Vitamin E 3 Ply Facial Tissues 95 Pack,$2.60,$2.74 / 100SS
Kleenex Aloe Vera & Vitamin E 3 Ply Facial Tissues 140 Pack,$3.60,$2.57 / 100SS
Symphony Facial Tissues White 228ss 3 Pack,$5.00,$0.73 / 100SS
Kleenex Large & Thick 3 Ply Facial Tissues 95 Pack,$2.80,$2.95 / 100SS
Swisspers Cotton Tips 240 Pack,$4.80,$2.00 / 100EA
Woolworths All Smiles Dental Floss Total Care Mint Picks 36 Pack,$1.80,$0.05 / 1EA
Sambucol Black Elderberry Immune Defence Forte Hard Capsules 30 Pack,$15.20,$0.51 / 1EA
Jack N' Jill Kids Bio Toothbrush Assorted Each,$5.00,$5.00 / 1EA
Difflam Sore Throat Spray 30ml,$12.00,$40.00 / 100ML
Freshwater Farm Sandalwood Oil & Kunzea Soap Bar 200g,$4.50,$2.25 / 100G
Tena Men Absorbent Protector Level 3 8 Pack,$8.80,$1.10 / 1EA
Oral-b Pro 100 Crossaction Midnight Black Electric Toothbrush Each,$80.00,$80.00 / 1EA
Tresemme Nourish & Shine Conditioner With Vitamin E & Hemp Seed Oil 940ml,$9.80,$1.04 / 100ML
Bic Hybrid 3 Comfort Shaver 12 Pack,$10.85,$0.90 / 1EA
Tresemme Volume & Fullness Conditioner Multi-vitamins & Coconut Oil 940ml,$9.80,$1.04 / 100ML
Sukin Signature Natural Deodorant Pump 125ml,$4.00,$3.20 / 100ML
Bondi Sands Tanning Mitt Tanning Mitt Each,$7.00,$7.00 / 1EA
Sukin Rosehip Nourishing Cream Cleanser 125ml,$8.00,$8.00 / 1EA
Dermaveen Soap-free Body Wash Oatmeal 500ml,$12.00,$2.40 / 100ML
D3 Strapping Tape Rigid 13.7m Each,$10.00,$10.00 / 1EA
Dove Men Hair Shampoo Fresh Clean 2 In 1 300ml,$5.00,$1.67 / 100ML
Sukin Haircare Deep Cleanse Shampoo 500ml,$9.50,$1.90 / 100ML
Dermaveen Body Wash Soap Free 500ml,$10.20,$2.04 / 100ML
Strepsils Herbal Cough Blocked Nose Sore Throat Lozenges Fresh Menthol 16 Pack,$7.00,$0.44 / 1EA
My Soda Smooth Conditioner 500ml,$12.00,$2.40 / 100ML
Palmolive 3in1 Shampoo Conditioner & Bodywash Funny Honey 700ml,$7.00,$1.00 / 100ML
"Sukin Anna Cole Body Wash Rosehip, Jojoba & Avocado Oils 1l",$13.00,$1.30 / 100ML
Libra Goodnights Pads Ultra Thin Wings 10 Pack,$3.50,$0.35 / 1EA
Balnea Calming Aloe Vera Anti Bacterial Hand Wash Refill 1l,$3.50,$0.35 / 100ML
Essentials Facial Tissues 224 Pack,$1.70,$0.76 / 100SS
Kleenex Everyday 2 Ply Facial Tissues 200 Pack,$3.00,$1.50 / 100SS
Quilton Facial Tissues Soft White 95 Pack,$1.40,$1.47 / 100SS
Kleenex Aloe Vera & Vitamin E 3 Ply Facial Tissues 95 Pack,$2.60,$2.74 / 100SS
Kleenex Aloe Vera & Vitamin E 3 Ply Facial Tissues 140 Pack,$3.60,$2.57 / 100SS
Symphony Facial Tissues White 228ss 3 Pack,$5.00,$0.73 / 100SS
Kleenex Large & Thick 3 Ply Facial Tissues 95 Pack,$2.80,$2.95 / 100SS
Swisspers Cotton Tips 240 Pack,$4.80,$2.00 / 100EA
Sukin Signature Hand & Nail Cream 125ml,$5.50,$4.40 / 100ML
Pantene Daily Moisture Renewal Nourishing Conditioner 900ml,$10.00,$1.11 / 100ML
Sukin Certified Organic Rosehip Oil 25ml,$13.50,$54.00 / 100ML
Neutrogena Ultra Sheer Body Lotion Sunscreen Spf 50 85ml,$16.00,$18.82 / 100ML
Designer White Tooth Toner Purple Polish Whitening Toothpaste 75ml,$6.00,$8.00 / 100ML
Thursday Plantation Oil Tea Tree 50ml,$18.00,$36.00 / 100ML
My Soda Smooth Conditioner 350ml,$10.00,$2.86 / 100ML
Vaseline Intensive Care Body Lotion Cocoa Glow 225ml,$6.50,$2.89 / 100ML
Designer White Tooth Toner Whitening Strips 28 Pack,$30.00,$1.07 / 1EA
Palmolive Instant Antibacterial Hand Sanitiser Cherry Blossom 48ml,$3.00,$6.25 / 100ML
Nivea Sun Ultra Sport Sunscreen Spray Spf50+ 200ml,$22.00,$11.00 / 100ML
Aveeno Daily Moisture Oat Milk Blend Shampoo For Gentle Cleanse 354ml,$19.50,$5.51 / 100ML
Pantene Pro-v  Sheer Volume Shampoo For Fine Hair 375ml,$5.00,$1.33 / 100ML
Herbal Essences Bio:renew White Grapefruit & Mint Volumising Shampoo 400ml,$13.50,$3.38 / 100ML
Schwarzkopf Extra Care Normal Balance Nourishing Treatment 150ml,$12.00,$8.00 / 100ML
Surf Life Saving Despicable Me Sunscreen Roll On Spf 50+ 75ml,$12.00,$16.00 / 100ML
Panadol Optizorb For Pain Relief Paracetamol 500mg Caplet 20 Pack,$4.00,$0.20 / 1EA
Herbal Essences Conditioner Hello Hydration 300ml,$7.00,$2.33 / 100ML
Garnier Fructis Full & Luscious Shampoo 850ml,$11.90,$1.40 / 100ML
Toni & Guy Casual Sea Salt Texturising Spray 200ml,$9.50,$4.75 / 100ML
Rexona Women Antiperspirant Aerosol Deodorant Classic 250ml,$6.00,$2.40 / 100ML
L'oreal Elvive Dream Lengths Super Detangling Conditioner 300ml,$8.50,$2.83 / 100ML
Garnier Fructis Coconut Water Shampoo Shampoo 315ml,$5.60,$1.78 / 100ML
Essentials Facial Tissues 224 Pack,$1.70,$0.76 / 100SS
Kleenex Everyday 2 Ply Facial Tissues 200 Pack,$3.00,$1.50 / 100SS
Quilton Facial Tissues Soft White 95 Pack,$1.40,$1.47 / 100SS
Kleenex Aloe Vera & Vitamin E 3 Ply Facial Tissues 95 Pack,$2.60,$2.74 / 100SS
Kleenex Aloe Vera & Vitamin E 3 Ply Facial Tissues 140 Pack,$3.60,$2.57 / 100SS
Symphony Facial Tissues White 228ss 3 Pack,$5.00,$0.73 / 100SS
Kleenex Large & Thick 3 Ply Facial Tissues 95 Pack,$2.80,$2.95 / 100SS
Swisspers Cotton Tips 240 Pack,$4.80,$2.00 / 100EA
Nurofen Zavance Fast Pain Relief Caplets 256mg Ibuprofen 24 Pack,$7.50,$0.31 / 1EA
Schick Mens Razor Exacta 2 Disposable Sensitive 18 Pack,$9.10,$0.51 / 1EA
Colgate Optic White Overnight Teeth Whitening Treatment Pen 2.5ml,$35.00,$35.00 / 1EA
Trishave 3in1 Anti-rash Shave Creme With Tea Tree Oil For Men 100g,$7.30,$7.30 / 100G
Thursday Plantation Tea Tree Antiseptic Spray 100ml,$9.50,$9.50 / 100ML
U By Kotex Extra Pads Super With Wings 14 Pack,$3.50,$0.25 / 1EA
Balnea Nourishing Cherry Blossom Hand Wash Refill 1l,$3.50,$0.35 / 100ML
Cancer Council Everyday Value Sunscreen Spf50+ 500ml,$25.00,$5.00 / 100ML
Voeu Refreshing Gel Wash 150ml,$4.00,$2.67 / 100ML
Dove Gentle Beauty Cream Bar Exfoliating Soap 90g X 4 Pack,$4.50,$1.25 / 100G
My Soda Hydrate Conditioner Refill 500ml,$6.00,$1.20 / 100ML
Tena Men Level 1 12 Pack,$8.80,$0.73 / 1EA
Dove Body Wash Restoring Soap With Coconut & Almond Oil Scent 1l,$17.00,$1.70 / 100ML
Schwarzkopf Extra Care Colour Perfector Protecting Conditioner 400ml,$9.00,$2.25 / 100ML
Marzena Natural Body Wax Strips 40 Pack,$15.00,$0.38 / 1EA
Redwin Anti Dandruff Shampoo Coal Tar Treatment 250ml,$5.50,$2.20 / 100ML
Schwarzkopf Extra Care Ultimate Repair Strengthening Conditioner 950ml,$19.00,$2.00 / 100ML
Bic Razor Disposable Twin Easy Sensitive 10 Pack,$3.50,$0.35 / 1EA
The Wiggles Toothpaste Vanilla Flavour Sugar Free 2-5 Years 96g,$2.80,$2.92 / 100G
Nivea Gentle Biodegradable Face Cleansing Makeup Wipes 25 Pack,$5.10,$0.20 / 1EA
Dove Nourishing Moisture Shampoo With Pro Moisture Complex 320ml,$7.70,$2.41 / 100ML
Gillette Venus Smooth Razor Each,$9.50,$9.50 / 1EA
Original Source Body Wash Tropical Coconut & Shea Butter Shower Gel 250ml,$5.00,$2.00 / 100ML
Tradie Date Night Body Spray 160ml,$6.00,$3.75 / 100ML
Essentials Facial Tissues 224 Pack,$1.70,$0.76 / 100SS
Kleenex Everyday 2 Ply Facial Tissues 200 Pack,$3.00,$1.50 / 100SS
Quilton Facial Tissues Soft White 95 Pack,$1.40,$1.47 / 100SS
Kleenex Aloe Vera & Vitamin E 3 Ply Facial Tissues 95 Pack,$2.60,$2.74 / 100SS
Kleenex Aloe Vera & Vitamin E 3 Ply Facial Tissues 140 Pack,$3.60,$2.57 / 100SS
Symphony Facial Tissues White 228ss 3 Pack,$5.00,$0.73 / 100SS
Kleenex Large & Thick 3 Ply Facial Tissues 95 Pack,$2.80,$2.95 / 100SS
Swisspers Cotton Tips 240 Pack,$4.80,$2.00 / 100EA
Neutrogena Beach Defence Sunscreen Lotion Spf 50 400ml,$34.00,$8.50 / 100ML
Bosisto's Antifungal Solution Tea Tree & Clove 100ml,$8.00,$8.00 / 100ML
Schick Razor Blades Quattro For Women Cartridges 4 Pack,$13.50,$3.38 / 1EA
Gillette Mach3+ Shaving Razor Each,$14.00,$14.00 / 1EA
Libra Extra Sanitary Pads Regular 14 Pack,$3.50,$0.25 / 1EA
Sukin Botanical Body Wash Lime & Coconut 1l,$13.00,$1.30 / 100ML
Schwarzkopf Extra Care Normal Balance Nourishing Repair Conditioner 250ml,$12.00,$4.80 / 100ML
Dettol Antibacterial Foam Hand Wash Pump Rose And Cherry 250ml,$3.50,$1.40 / 100ML
U By Kotex Extra Overnight Pads With Wings 10 Pack,$3.50,$0.35 / 1EA
Rexona Women Clinical Roll On Summer Strength 50ml,$8.00,$16.00 / 100ML
Schwarzkopf Extra Care Marrakesh Oil & Coconut Conditioner 950ml,$19.00,$2.00 / 100ML
Palmolive Naturals Body Wash Pomegranate With Mango Shower Gel 1l,$10.00,$1.00 / 100ML
Palmolive Naturals Body Wash Anti Stress Shower Gel 500ml,$6.50,$1.30 / 100ML
Palmolive Naturals Body Wash Milk & Cherry Blossom Shower Gel 1l,$10.00,$1.00 / 100ML
Sukin Blemish Control Oil Free Moisturiser 125ml,$8.00,$6.40 / 100ML
Vaseline Intensive Care Hand Cream Healthy Hands Stronger Nails 75ml,$5.30,$7.07 / 100ML
Tena Ultra Thin Mini Pads 20 Pack,$4.40,$0.22 / 1EA
Tena Pants For Men Level 4 Medium To Large 8 Pack,$15.20,$1.90 / 1EA
Sukin Pureley Ageless Rejuvenating Day Cream 120ml,$15.00,$12.50 / 100ML
U By Kotex Ultrathin Pads Regular No Wings 14 Pack,$3.50,$0.25 / 1EA
Wet Stuff Gold Lubricant Gold 270g,$6.80,$2.52 / 100G
Rexona For Men Clinical Protection Deodorant Sport 180ml,$12.00,$6.67 / 100ML
Essentials Facial Tissues 224 Pack,$1.70,$0.76 / 100SS
Kleenex Everyday 2 Ply Facial Tissues 200 Pack,$3.00,$1.50 / 100SS
Quilton Facial Tissues Soft White 95 Pack,$1.40,$1.47 / 100SS
Kleenex Aloe Vera & Vitamin E 3 Ply Facial Tissues 95 Pack,$2.60,$2.74 / 100SS
Kleenex Aloe Vera & Vitamin E 3 Ply Facial Tissues 140 Pack,$3.60,$2.57 / 100SS
Symphony Facial Tissues White 228ss 3 Pack,$5.00,$0.73 / 100SS
Kleenex Large & Thick 3 Ply Facial Tissues 95 Pack,$2.80,$2.95 / 100SS
Swisspers Cotton Tips 240 Pack,$4.80,$2.00 / 100EA
Palmolive Foaming Liquid Hand Wash Soap Refill Japanese Cherry Blossom 1l,$4.25,$0.43 / 100ML
Balnea Aloe Vera Antibacterial Hand Wash 250ml,$2.40,$0.96 / 100ML
Palmolive Foaming Liquid Hand Wash Soap Vanilla & Sweet Almond 400ml,$3.50,$0.88 / 100ML
Zeiss Lens Wipes 50 Pack,$7.00,$0.14 / 1EA
Cancer Council Everyday Value Sunscreen Spf50+ 110ml,$12.50,$11.36 / 100ML
Ethical Zinc Spf 50+ Natural Clear Zinc Sunscreen 100g,$25.00,$25.00 / 100G
Schwarzkopf Live Colour Silver Toner Semi Permanent Each,$14.00,$18.67 / 100ML
Help@hand Tea Tree Oil 200ml,$7.00,$3.50 / 100ML
Sukin Fresh Cotton Natural Deodorant Pump 125ml,$4.00,$3.20 / 100ML
Sun Zapper Spf50 Mixed Sunscreen Pack Assorted 12g X3 Pack,$21.50,$3.58 / 100G
Vagisil Scentsitive Scents Daily Intimate Wash Peach Blossom 354ml,$8.50,
Balnea Shower Cap Each,$2.00,$2.00 / 1EA
Hawaiian Tropic Tropic Silk Hydration Sunscreen Spray Spf 50 175g,$22.00,$12.57 / 100G
Rimmel Insta Fix & Go Primer & Setting Spray 100ml,$16.00,$16.00 / 100ML
Palmolive Antibacterial Foaming Liquid Hand Wash Soap Pump Lime 250ml,$2.00,$0.80 / 100ML
Vicks Cough Syrup Dry & Chesty 200ml,$14.00,$7.00 / 100ML
Betadine Sore Throat Gargle Ready To Use 120ml,$15.40,$12.83 / 100ML
Herbal Essences Shampoo Colour Me Happy 300ml,$7.00,$2.33 / 100ML
Vo5 Hairspray Extra Hold 200g,$5.00,$2.50 / 100G
Balnea Almond Milk & Jojoba Oil Hand Wash 250ml,$2.40,$0.96 / 100ML
Mcobeauty Super Glow Bronzing Drops 30ml,$32.00,$10.67 / 10ML
Banana Boat Baby Sunscreen Roll On Spf 50+ 75ml,$12.50,$16.67 / 100ML
Essentials Facial Tissues 224 Pack,$1.70,$0.76 / 100SS
Kleenex Everyday 2 Ply Facial Tissues 200 Pack,$3.00,$1.50 / 100SS
Quilton Facial Tissues Soft White 95 Pack,$1.40,$1.47 / 100SS
Kleenex Aloe Vera & Vitamin E 3 Ply Facial Tissues 95 Pack,$2.60,$2.74 / 100SS
Kleenex Aloe Vera & Vitamin E 3 Ply Facial Tissues 140 Pack,$3.60,$2.57 / 100SS
Symphony Facial Tissues White 228ss 3 Pack,$5.00,$0.73 / 100SS
Kleenex Large & Thick 3 Ply Facial Tissues 95 Pack,$2.80,$2.95 / 100SS
Swisspers Cotton Tips 240 Pack,$4.80,$2.00 / 100EA
Voltaren Emulgel No Mess 75g,$21.00,$28.00 / 100G
Banana Boat Ultra Spf 50+ Sunscreen Pump 400g,$24.00,$6.00 / 100G
Sukin Volumising Shampoo 1l,$23.00,$2.30 / 100ML
Bic Flex 4 Hybrid Shaver 4 Pack,$6.65,$1.66 / 1EA
Colgate Brush Your Way Slim Soft Advanced Toothbrush Utra Soft 3 Pack,$6.00,$2.00 / 1EA
Palmolive Naturals Intensive Moisture Shampoo 350ml,$6.00,$1.71 / 100ML
Neutrogena Beach Defence Sunscreen Lotion Spf 50 198ml,$20.00,$10.10 / 100ML
Banana Boat Ultra Clear Spf 50+ Sunscreen Spray 175g,$21.00,$12.00 / 100G
Bondi Sands Self Tan Foam Light Medium 200ml,$15.40,$7.70 / 100ML
Gillette Venus For Pubic Hair & Skin Razor With 2 Razor Blades Each,$23.00,$23.00 / 1EA
Voeu Age Rejuvenate Night Cream 50ml,$7.00,$14.00 / 100ML
Balnea Milk & Honey Body Wash 1l,$4.50,$0.45 / 100ML
Edge Mens Twin Blade Disposable 20 Pack,$4.40,$0.22 / 1EA
Libra Ultra Thins Sanitary Pads Goodnights With Wings 20 Pack,$8.50,$0.43 / 1EA
Help@hand Cotton Tips No Plastic Stems 200 Pack,$2.00,
Palmolive Naturals Active Nourishment Normal Hair Conditioner Aloe 700ml,$7.00,$1.00 / 100ML
Dove Intensive Repair Shampoo With Smart Target Technology 320ml,$7.70,$2.41 / 100ML
Go2 Dentagenie Tongue Cleaner 20 Pack,$3.00,$0.15 / 1EA
Dove Daily Care Shampoo With Lightweight Technology 820ml,$17.00,$2.07 / 100ML
Nurofen Zavance Fast Pain Relief Tablets 256mg Ibuprofen 24 Pack,$7.50,$0.31 / 1EA
Schick Hydro 5 Razor Refill 4 Pack,$17.50,$4.38 / 1EA
Sukin Rosehip Hydrating Day Cream 120ml,$14.00,$14.00 / 1EA
Tradie Stallion Body Deodorant Spray 160ml,$6.00,$3.75 / 100ML
Essentials Facial Tissues 224 Pack,$1.70,$0.76 / 100SS
Kleenex Everyday 2 Ply Facial Tissues 200 Pack,$3.00,$1.50 / 100SS
Quilton Facial Tissues Soft White 95 Pack,$1.40,$1.47 / 100SS
Kleenex Aloe Vera & Vitamin E 3 Ply Facial Tissues 95 Pack,$2.60,$2.74 / 100SS
Kleenex Aloe Vera & Vitamin E 3 Ply Facial Tissues 140 Pack,$3.60,$2.57 / 100SS
Symphony Facial Tissues White 228ss 3 Pack,$5.00,$0.73 / 100SS
Kleenex Large & Thick 3 Ply Facial Tissues 95 Pack,$2.80,$2.95 / 100SS
Swisspers Cotton Tips 240 Pack,$4.80,$2.00 / 100EA
Rexona Women Antiperspirant Aerosol Deodorant Hypo-allergenic 250ml,$6.00,$2.40 / 100ML
Gillette Venus Deluxe Smooth Sensitive Razor Blades 4 Pack,$27.00,$27.00 / 1EA
Thanks To Nature Smooth & Control Shampoo With Keratin 500ml,$9.00,$1.80 / 100ML
Dove Summer Glow Gradual Tan Body Lotion Medium To Dark Skin 250ml,$9.50,$3.80 / 100ML
Cancer Council Active Sunscreen Pump Bottle Spf 50 Plus 200ml,$18.00,$9.00 / 100ML
Palmolive Naturals Active Nourishment Shampoo Aloe Vera 350ml,$6.00,$1.71 / 100ML
Oscar Orsen Nail Scissors Each,$7.00,$7.00 / 1EA
Nivea Sun Protect & Light Feel Sunscreen Lotion Spf30 200ml,$20.00,$10.00 / 100ML
Palmolive Naturals Smooth & Shine Hair Conditioner Keratin 700ml,$7.00,$1.00 / 100ML
Panadol Optizorb For Pain Relief Paracetamol 500mg Tablet 20 Pack,$4.00,$0.20 / 1EA
Vicks First Defence Nasal Spray 15ml,$15.00,$100.00 / 100ML
Gillette Venus Comfortglide White Tea Razor With 2 Razor Blades Each,$17.50,$8.75 / 1EA
Dove Restoring Ritual Shampoo With Coconut Oil 320ml,$7.70,$2.41 / 100ML
Sukin Ocean Mist Natural Deodorant Pump 125ml,$4.00,$3.20 / 100ML
Sukin Volumising Shampoo 500ml,$9.50,$1.90 / 100ML
Schwarzkopf Extra Care Supreme Length Fortifying Shampoo 400ml,$9.00,$2.25 / 100ML
Radox Body Wash Feel Oxygenated 1l,$9.50,$0.95 / 100ML
Banana Boat Kids Sunscreen Spray 50+ 240ml,$19.00,$7.92 / 100ML
Oscar Orsen Scrunchy Scrunchie Each,$4.00,
Oral-b 3d White Perfection Toothpaste Toothpaste 95g,$10.00,$10.53 / 100G
Nivea Gentle Biodegradable Face Cleansing Makeup Wipes 2 Pack,$12.00,$0.24 / 1EA
Nivea Sun Uv Shine Control Spf50+ Sun Mattifying Face Sunscreen 50ml,$17.00,$34.00 / 100ML
Dove Shea Butter Beauty Cream Soap Bars 90g X 6 Pack,$8.80,$1.63 / 100G
Nurofen Pain And Inflammation Relief Tablets 200mg Ibuprofen 24 Pack,$6.00,$0.25 / 1EA
Essentials Facial Tissues 224 Pack,$1.70,$0.76 / 100SS
Kleenex Everyday 2 Ply Facial Tissues 200 Pack,$3.00,$1.50 / 100SS
Quilton Facial Tissues Soft White 95 Pack,$1.40,$1.47 / 100SS
Kleenex Aloe Vera & Vitamin E 3 Ply Facial Tissues 95 Pack,$2.60,$2.74 / 100SS
Kleenex Aloe Vera & Vitamin E 3 Ply Facial Tissues 140 Pack,$3.60,$2.57 / 100SS
Symphony Facial Tissues White 228ss 3 Pack,$5.00,$0.73 / 100SS
Kleenex Large & Thick 3 Ply Facial Tissues 95 Pack,$2.80,$2.95 / 100SS
Swisspers Cotton Tips 240 Pack,$4.80,$2.00 / 100EA
Listerine Freshburst Antibacterial Mouthwash 500ml,$8.00,$1.60 / 100ML
Schick Hydro Silk Razor Blades 4 Pack,$24.00,$6.00 / 1EA
Rexona Women Clinical Antiperspirant Cream Deodorant Shower Clean 45ml,$14.00,$31.11 / 100ML
Difflam Forte Throat Spray 15ml,$17.00,$113.33 / 100ML
Woobamboo Kids Bamboo Toothbrush 2 Pack,$8.00,$4.00 / 1EA
Radox Bath Gel Muscle Soak 500ml,$7.20,$1.44 / 100ML
Rexona Women Antiperspirant Aerosol Advanced Protection Watermelon 220ml,$9.50,$4.32 / 100ML
Head & Shoulders Ultramen Deep Clean 2in1 Dandruff Shampoo & Conditioner 550ml,$20.00,$3.64 / 100ML
Vaseline Lip Care Tub Rosy 7g,$5.00,$71.43 / 100G
Evamay Liners Regular 20 Pack,$1.10,$0.06 / 1EA
Vicks Vaposhower Tablets 5 Pack,$14.90,$2.98 / 1EA
Dove Beauty Cream Bar Sensitive Soap 90g X 6 Pack,$8.80,$1.63 / 100G
Sukin Rosehip Enriching Night Cream 120ml,$14.00,$14.00 / 1EA
Quick-eze Antacids Forest Berry 24 Pack,$7.50,$0.31 / 1EA
Mcobeauty Everyday Precision Tweezer Each,$12.00,
Surf Life Saving Sunscreen Sport Spf 50+ 200ml,$18.00,$9.00 / 100ML
Le Tan Deep Bronze Self Tan Foaming Mousse 110ml,$14.00,$12.73 / 100ML
"Tresemme Length Protect Shampoo With Biotin, Coconut & Jojoba Oils 940ml",$9.80,$1.04 / 100ML
Dove Conditioner Daily Care With Lightweight Technology 320ml,$7.70,$2.41 / 100ML
Libra Goodnights Pads 10 Pack,$3.50,$0.35 / 1EA
Simple Daily Skin Detox Purifying Facial Wash 150ml,$8.00,$5.33 / 100ML
Garnier Fructis Hair Food Volumising Watermelon Shampoo 350ml,$13.00,$3.71 / 100ML
Voeu Hydrating Face Mask Each,$2.40,$2.40 / 1EA
Essentials Facial Tissues 224 Pack,$1.70,$0.76 / 100SS
Kleenex Everyday 2 Ply Facial Tissues 200 Pack,$3.00,$1.50 / 100SS
Quilton Facial Tissues Soft White 95 Pack,$1.40,$1.47 / 100SS
Kleenex Aloe Vera & Vitamin E 3 Ply Facial Tissues 95 Pack,$2.60,$2.74 / 100SS
Kleenex Aloe Vera & Vitamin E 3 Ply Facial Tissues 140 Pack,$3.60,$2.57 / 100SS
Symphony Facial Tissues White 228ss 3 Pack,$5.00,$0.73 / 100SS
Kleenex Large & Thick 3 Ply Facial Tissues 95 Pack,$2.80,$2.95 / 100SS
Swisspers Cotton Tips 240 Pack,$4.80,$2.00 / 100EA
Vo5 Hairspray Firm Hold 200g,$5.00,$2.50 / 100G
Dove Womens Roll On Deodorant Original 50ml,$5.00,$10.00 / 100ML
Dove Summer Glow Body Lotion Fair To Medium Gradual Tan 250ml,$9.50,$3.80 / 100ML
Nivea Micellar Biodegradable Face Cleansing Makeup Wipes 25 Pack,$5.10,$0.20 / 1EA
Vo5 Style Wax Mega Hold Gel Tube 175ml,$5.00,$2.86 / 100ML
Pantene Ultimate 10 Repair & Protect Shampoo For Damage 375ml,$5.00,$1.33 / 100ML
Schwarzkopf Extra Care Push Up Volume Lifting Conditioner 400ml,$9.00,$2.25 / 100ML
Quick-eze Heartburn & Indigestion Relief Original 60 Pack,$9.00,$0.15 / 1EA
Oscar Orsen Disposablewomens Razors 10 Pack,$2.50,$0.25 / 1EA
Pantene Micellar Rosewater Moisturising Shampoo 530ml,$9.00,$1.70 / 100ML
Bondi Sands Spf50+ Fragrance Free Sunscreen Lotion 500ml,$19.60,$3.92 / 100ML
Cancer Council Day Wear Water Resistant Spf 50+ 75ml,$14.50,$19.33 / 100ML
Panadol Extra With Optizorb Paracetamol Pain Relief 20 Pack,$7.50,$0.38 / 1EA
Balnea Pumice Stone Each,$4.00,$4.00 / 1EA
Bondi Sands Spf50 Fragrance Free Lotion 150ml,$10.50,$7.00 / 100ML
Voeu Revitalising Pink Grapefruit Foam Wash 150ml,$4.00,$2.67 / 100ML
Help@hand Cotton Tips 400 Pack,$3.85,$0.96 / 100EA
Sensodyne Complete Care Extrafresh 100g,$12.30,$12.30 / 100G
Banana Boat Spf 50+ Sunscreen Sport Tube 100g,$13.75,$13.75 / 100G
Balnea Moisturising Milk & Honey Hand Wash Refill 1l,$3.50,$0.35 / 100ML
So? Unique Vanilla Candy Body Spray 150ml,$9.95,$6.63 / 100ML
L'oreal Elvive Colour Protecting Conditioner 300ml,$8.50,$2.83 / 100ML
Simple 3% Hyaluronic Acid + B5 Booster Serum 30ml,$14.00,$46.67 / 100ML
Rosken Skin Repair Hand Cream For Dry Skin 75ml,$2.70,$3.60 / 100ML
Essentials Facial Tissues 224 Pack,$1.70,$0.76 / 100SS
Kleenex Everyday 2 Ply Facial Tissues 200 Pack,$3.00,$1.50 / 100SS
Quilton Facial Tissues Soft White 95 Pack,$1.40,$1.47 / 100SS
Kleenex Aloe Vera & Vitamin E 3 Ply Facial Tissues 95 Pack,$2.60,$2.74 / 100SS
Kleenex Aloe Vera & Vitamin E 3 Ply Facial Tissues 140 Pack,$3.60,$2.57 / 100SS
Symphony Facial Tissues White 228ss 3 Pack,$5.00,$0.73 / 100SS
Kleenex Large & Thick 3 Ply Facial Tissues 95 Pack,$2.80,$2.95 / 100SS
Swisspers Cotton Tips 240 Pack,$4.80,$2.00 / 100EA
Palmolive Naturals Body Wash Sea Minerals Shower Gel 1l,$10.00,$1.00 / 100ML
Dove Womens Roll On Deodorant Pomegranate 50ml,$5.00,$10.00 / 100ML
Nivea Men Sensitive Shave Gel With Chamomile & Vitamin E 200ml,$4.50,$2.25 / 100ML
Balnea Oxygen Burst Body Wash 1l,$4.50,$0.45 / 100ML
Sukin Cleansing Hand Wash Reef Aid Sea Breeze 500ml,$5.50,$1.10 / 100ML
Schick Hydro Silk Razor Kit Each,$11.55,$11.55 / 1EA
Palmolive Men's Anti Dandruff Shampoo 350ml,$3.00,$0.86 / 100ML
Dove Nourishing Secrets Strengthening Ritual Shampoo 320ml,$7.70,$2.41 / 100ML
Band-aid Tough Strips Extra Large Fabric Bandages 10 Pack,$4.00,$0.40 / 1EA
Colgate 360 Advanced Toothbrush Soft 4 Pack,$9.00,$2.25 / 1EA
Palmolive Luminous Oils Body Wash Coconut Oil Shower Gel 400ml,$3.00,$0.75 / 100ML
Palmolive Luminous Oils Coconut Oil & Frangipani Shampoo 700ml,$10.00,$1.43 / 100ML
Voeu Age Rejuvenate Day Cream 50ml,$7.00,$14.00 / 100ML
Radox Mineral Therapy Feel Extreme Body Wash & Shower Gel 1l,$9.50,$0.95 / 100ML
Chapstick Lip Care Conditioning Lip Balm Sunscreen Spf15 4.2g,$2.70,$64.29 / 100G
Garnier Fructis Full & Luscious Conditioner 315ml,$5.60,$1.78 / 100ML
Gillette Sensor3 Mens Disposable Razors For Sensitive Skin 4 Pack,$7.50,$1.88 / 1EA
Help@hand Cotton Balls 200 Pack,$2.00,$1.00 / 100EA
Lynx Body Spray Aerosol Deodorant Africa 165ml,$8.00,$4.85 / 100ML
