Product Name,Price,Price per Unit
Olay Total Effects Face Cream Moisturiser Normal Skin Care 50g,$40.00,$80.00 / 100G
Olay Regenerist Micro-sculpting Face Cream Moisturiser 50g,$60.00,$120.00 / 100G
Olay Regenerist Whips Face Cream Moisturiser Uv Spf 30 50g,$60.00,$120.00 / 100G
Nivea Cellular Serum 30ml,$27.00,$90.00 / 100ML
Essentials Facial Tissues 224 Pack,$1.70,$0.76 / 100SS
Kleenex Everyday 2 Ply Facial Tissues 200 Pack,$3.00,$1.50 / 100SS
Quilton Facial Tissues Soft White 95 Pack,$1.40,$1.47 / 100SS
Kleenex Aloe Vera & Vitamin E 3 Ply Facial Tissues 140 Pack,$3.60,$2.57 / 100SS
Quilton 2ply Tissue Hypo-allergenic 250 Pack,$2.90,$1.16 / 100SS
Quilton Gold 4 Ply Tissues Aloe Vera 100 Pack,$2.20,$2.20 / 100SS
Olay Regenerist Collagen Peptide Moisturiser Skin Care 50g,$60.00,$120.00 / 100G
Olay Regenerist Retinol 24 Night Moisturiser Face Cream 50g,$59.00,$118.00 / 100G
Olay Regenerist Face Cream Moisturiser Fragrance Free 48g,$60.00,$125.00 / 100G
Olay Regenerist Retinol 24 Night Face Serum 30ml,$60.00,$200.00 / 100ML
Kleenex Eucalyptus 3 Ply Facial Tissues 95 Pack,$2.60,$2.74 / 100SS
Sorbent Facial Tissues Thick & Large White 95 Pack,$2.20,$2.32 / 100SS
Kleenex Aloe Vera & Vitamin E 3 Ply Facial Tissues 95 Pack,$2.60,$2.74 / 100SS
Colgate Total Original Antibacterial Toothpaste 200g,$6.00,$3.00 / 100G
Symphony Facial Tissues White 228ss 3 Pack,$5.00,$0.73 / 100SS
Kleenex Large & Thick 3 Ply Facial Tissues 95 Pack,$2.80,$2.95 / 100SS
Quilton Facial Tissue White 3ply 55ss White 3ply Each,$2.30,$4.18 / 100SS
Kleenex Eucalyptus 3 Ply Facial Tissues 140 Pack,$3.60,$2.57 / 100SS
Kleenex Soft & Thick 3 Ply Facial Tissues 95 Pack,$2.70,$2.84 / 100SS
Palmolive Naturals Replenishing Bar Soap Milk & Honey 90g X4 Pack,$5.00,$1.39 / 100G
Colgate Maximum Cavity Protection Toothpaste 180g,$3.50,$1.94 / 100G
Sorbent Hypo-allergenic Pure White Tissues 170 Pack,$2.00,$1.18 / 100SS
Colgate Total Original Antibacterial Toothpaste 115g,$4.00,$3.48 / 100G
Colgate Triple Action With Extra Micro Cleaning Minerals 165g,$3.50,$2.12 / 100G
U By Kotex Tampons Regular Regular 16 Pack,$3.50,$0.22 / 1EA
Macleans Toothpaste Multi Action Whitening Fluoride 170g,$3.50,$2.06 / 100G
Kleenex Aloe Vera & Vitamin E 3 Ply Large & Thick Facial Tissues 70 Pack,$2.60,$3.71 / 100SS
Colgate Sensitive Teeth Pain Whitening Fluoride Toothpaste 110g,$9.00,$8.18 / 100G
Olay Total Effects Face Cream Moisturiser Normal Skin Care 50g,$40.00,$80.00 / 100G
Olay Regenerist Micro-sculpting Face Cream Moisturiser 50g,$60.00,$120.00 / 100G
Olay Regenerist Whips Face Cream Moisturiser Uv Spf 30 50g,$60.00,$120.00 / 100G
Nivea Cellular Serum 30ml,$27.00,$90.00 / 100ML
Essentials Facial Tissues 224 Pack,$1.70,$0.76 / 100SS
Kleenex Everyday 2 Ply Facial Tissues 200 Pack,$3.00,$1.50 / 100SS
Quilton Facial Tissues Soft White 95 Pack,$1.40,$1.47 / 100SS
Kleenex Aloe Vera & Vitamin E 3 Ply Facial Tissues 140 Pack,$3.60,$2.57 / 100SS
Quilton 2ply Tissue Hypo-allergenic 250 Pack,$2.90,$1.16 / 100SS
Quilton Gold 4 Ply Tissues Aloe Vera 100 Pack,$2.20,$2.20 / 100SS
Olay Regenerist Collagen Peptide Moisturiser Skin Care 50g,$60.00,$120.00 / 100G
Olay Regenerist Retinol 24 Night Moisturiser Face Cream 50g,$59.00,$118.00 / 100G
Olay Regenerist Face Cream Moisturiser Fragrance Free 48g,$60.00,$125.00 / 100G
Olay Regenerist Retinol 24 Night Face Serum 30ml,$60.00,$200.00 / 100ML
Kleenex Eucalyptus 3 Ply Facial Tissues 95 Pack,$2.60,$2.74 / 100SS
Sorbent Facial Tissues Thick & Large White 95 Pack,$2.20,$2.32 / 100SS
Kleenex Aloe Vera & Vitamin E 3 Ply Facial Tissues 95 Pack,$2.60,$2.74 / 100SS
Colgate Total Original Antibacterial Toothpaste 200g,$6.00,$3.00 / 100G
Symphony Facial Tissues White 228ss 3 Pack,$5.00,$0.73 / 100SS
Kleenex Large & Thick 3 Ply Facial Tissues 95 Pack,$2.80,$2.95 / 100SS
Quilton Facial Tissue White 3ply 55ss White 3ply Each,$2.30,$4.18 / 100SS
Kleenex Eucalyptus 3 Ply Facial Tissues 140 Pack,$3.60,$2.57 / 100SS
Kleenex Soft & Thick 3 Ply Facial Tissues 95 Pack,$2.70,$2.84 / 100SS
Palmolive Naturals Replenishing Bar Soap Milk & Honey 90g X4 Pack,$5.00,$1.39 / 100G
Colgate Maximum Cavity Protection Toothpaste 180g,$3.50,$1.94 / 100G
Sorbent Hypo-allergenic Pure White Tissues 170 Pack,$2.00,$1.18 / 100SS
Colgate Total Original Antibacterial Toothpaste 115g,$4.00,$3.48 / 100G
Colgate Triple Action With Extra Micro Cleaning Minerals 165g,$3.50,$2.12 / 100G
U By Kotex Tampons Regular Regular 16 Pack,$3.50,$0.22 / 1EA
Macleans Toothpaste Multi Action Whitening Fluoride 170g,$3.50,$2.06 / 100G
Kleenex Aloe Vera & Vitamin E 3 Ply Large & Thick Facial Tissues 70 Pack,$2.60,$3.71 / 100SS
Colgate Sensitive Teeth Pain Whitening Fluoride Toothpaste 110g,$9.00,$8.18 / 100G
Sensodyne Toothpaste Sensitive Teeth Daily Care Whitening 110g,$9.70,$8.82 / 100G
Woolworths Sunscreen Spf 50+ 1l,$12.00,$1.20 / 100ML
All Smiles Toothbrush Medium 2 Pack,$2.00,$1.00 / 1EA
Grants Of Australia Toothpaste Mild Mint 110g,$3.80,$3.45 / 100G
Swisspers Cotton Pads Make Up 80 Pack,$4.10,$5.13 / 100EA
Natures Organics Fruits Shampoo Balance Apple Fresh 500ml,$2.00,$0.40 / 100ML
Kleenex Everyday Kids 2 Ply Facial Tissues 200 Pack,$3.00,$1.50 / 100SS
Colgate Total Advanced Clean Antibacterial Toothpaste 115g,$6.50,$5.65 / 100G
Priya Australian Sandalwood Body Balance Bar 100g,$2.50,$2.50 / 100G
Colgate Kids Minions 6+ Years Mint Gel Children's Toothpaste 90g,$3.00,$3.33 / 100G
Colgate Optic White Expert Stain-less Teeth Whitening Toothpaste 85g,$12.00,$14.12 / 100G
Oral-b Pro Health Fluoride Toothpaste Advanced Deep Clean Mint 110g,$6.00,$5.45 / 100G
Sensodyne Sensitive Teeth Pain Repair & Protect Whitening Toothpaste 100g,$12.30,$12.30 / 100G
Country Life Soap Bar Fresh Linen 5 Pack,$4.20,$0.93 / 100G
All Smiles Toothbrush Soft 2 Pack,$2.00,$1.00 / 1EA
Colgate Total Original Travel Antibacterial Toothpaste 40g,$2.00,$5.00 / 100G
Sunsilk Biotin Shampoo Longer & Stronger Hair 700ml,$12.00,$1.71 / 100ML
Kleenex Aloe Vera & Vitamin E 3 Ply Facial Tissues Cube 60 Pack,$3.00,$5.00 / 100SS
Macleans Toothpaste Multi Action Original Fluoride 170g,$3.50,$2.06 / 100G
Natures Organics Fruits Shampoo Shine Wild Berry 500ml,$2.00,$0.40 / 100ML
Colgate Cavity Protection Great Regular Flavour 90g,$2.00,$2.22 / 100G
Sensodyne Toothpaste Sensitive Teeth Daily Care Extra Fresh 110g,$9.70,$8.82 / 100G
Sorbent Facial Tissues 4ply Pocket Pack 6 Pack,$2.20,$3.67 / 100SS
Essentials Facial Tissues 224 Pack,$1.70,$0.76 / 100SS
Kleenex Everyday 2 Ply Facial Tissues 200 Pack,$3.00,$1.50 / 100SS
Quilton Facial Tissues Soft White 95 Pack,$1.40,$1.47 / 100SS
Kleenex Aloe Vera & Vitamin E 3 Ply Facial Tissues 95 Pack,$2.60,$2.74 / 100SS
Kleenex Aloe Vera & Vitamin E 3 Ply Facial Tissues 140 Pack,$3.60,$2.57 / 100SS
Symphony Facial Tissues White 228ss 3 Pack,$5.00,$0.73 / 100SS
Kleenex Large & Thick 3 Ply Facial Tissues 95 Pack,$2.80,$2.95 / 100SS
Swisspers Cotton Tips 240 Pack,$4.80,$2.00 / 100EA
Colgate 360 Whole Mouth Clean Soft Toothbrush Value Pack 2 Pack,$4.00,$2.00 / 1EA
Vaseline Petroleum Jelly Original 100g,$5.50,$5.50 / 100G
Libra Tampons Regular 16 Pack,$3.00,$0.19 / 1EA
All Smiles Total Care Toothpaste 140g,$1.50,$1.07 / 100G
Oral-b Pro Health Toothpaste Advanced Whitening 110g,$5.50,$5.00 / 100G
Colgate Advanced Whitening Tartar Control Toothpaste 115g,$6.50,$5.65 / 100G
Aloe Vera Tissues 3ply 95 Pack,$2.00,$2.11 / 100SS
Woolworths Sunscreen Everyday Tube Spf 50+ 100ml,$3.00,$3.00 / 100ML
Colgate Total Advanced Whitening Antibacterial Toothpaste 115g,$6.50,$5.65 / 100G
Colgate Cavity Protection Great Regular Toothpaste Pump 130g,$6.00,$4.62 / 100G
Colgate Kids Junior Bluey 2-5 Years Children's Toothpaste 90g,$3.00,$3.33 / 100G
Sensodyne Toothpaste Sensitive Teeth Pain Repair & Protect Fluoride 100g,$12.30,$12.30 / 100G
Libra Tampons Super 16 Pack,$3.00,$0.19 / 1EA
Oc Naturals Shampoo Normal Balance 400ml,$3.70,$0.93 / 100ML
Palmolive Naturals Balanced & Mild Bar Soap Chamomile Extracts 90g X4 Pack,$5.00,$1.39 / 100G
Colgate Total Mint Stripe Gel Antibacterial Toothpaste 115g,$4.00,$3.48 / 100G
Colgate Total Advanced Clean Antibacterial Toothpaste 200g,$5.00,$2.50 / 100G
Colgate Zig Zag Interdental Clean Medium Manual Toothbrush Value 6 Pack,$9.00,$1.50 / 1EA
Colgate Extra Clean Soft Toothbrush With Rubber Tongue Cleaner 1 Pack,$2.00,$2.00 / 1EA
Colgate Total Mint Stripe Gel Antibacterial Toothpaste 200g,$6.00,$3.00 / 100G
Woolworths Sunscreen Spf 50+ 500ml,$9.00,$1.80 / 100ML
Colgate 360 Whole Mouth Clean Medium Toothbrush Value Pack 2 Pack,$4.00,$2.00 / 1EA
Sunsilk Shampoo Soft & Smooth 700ml,$12.00,$1.71 / 100ML
Colgate Advanced Whitening Tartar Control Toothpaste 200g,$5.00,$2.50 / 100G
Essentials Facial Tissues 224 Pack,$1.70,$0.76 / 100SS
Kleenex Everyday 2 Ply Facial Tissues 200 Pack,$3.00,$1.50 / 100SS
Quilton Facial Tissues Soft White 95 Pack,$1.40,$1.47 / 100SS
Kleenex Aloe Vera & Vitamin E 3 Ply Facial Tissues 95 Pack,$2.60,$2.74 / 100SS
Kleenex Aloe Vera & Vitamin E 3 Ply Facial Tissues 140 Pack,$3.60,$2.57 / 100SS
Symphony Facial Tissues White 228ss 3 Pack,$5.00,$0.73 / 100SS
Kleenex Large & Thick 3 Ply Facial Tissues 95 Pack,$2.80,$2.95 / 100SS
Swisspers Cotton Tips 240 Pack,$4.80,$2.00 / 100EA
Colgate Sensitive Pro-relief Whitening Teeth Pain Toothpaste 110g,$5.50,$5.00 / 100G
U By Kotex Tampons Regular Regular Bulk 32 Pack,$8.00,$0.25 / 1EA
Natures Organics Fruits Shampoo Restore Coconut Lime 500ml,$2.00,$0.40 / 100ML
Libra Tampons Regular 32 Pack,$7.00,$0.22 / 1EA
Natures Organics Fruits Conditioner Balance Apple Fresh 500ml,$2.00,$0.40 / 100ML
Sorbent Vanilla Fragrance Collection Facial Tissues 170 Pack,$2.00,$1.18 / 100SS
Colgate Total Charcoal Deep Clean Antibacterial Toothpaste 115g,$6.50,$5.65 / 100G
Oral-b Gum Care & Sensitive Repair Fluoride Toothpaste 110g,$10.00,$9.09 / 100G
Natures Organics Fruits Conditioner Shine Wild Berry 500ml,$2.00,$0.40 / 100ML
Palmolive Gold Bar Soap Daily Deodorant Protection 90g X4 Pack,$5.00,$1.39 / 100G
Colgate Extra Clean Medium Toothbrush With Rubber Tongue Cleaner 1 Pack,$2.00,$2.00 / 1EA
Kleenex Everyday 2 Ply Facial Tissues 250 Pack,$4.00,$1.60 / 100SS
Colgate Kids Bluey 2-5 Years Extra Soft Bristles Toothbrush Each,$3.50,$3.50 / 1EA
Savlon Soothing & Healing Antiseptic Cream 75g,$8.00,$10.67 / 100G
Colgate Sensitive Pro-relief Multi Protection Toothpaste 110g,$5.50,$5.00 / 100G
Tampax Super Tampons Medium Flow With Applicator 20 Pack,$5.95,$0.30 / 1EA
Colgate Maximum Cavity Protection For Calcium Boost Mint 180g,$3.50,$1.94 / 100G
Colgate Optic White Sparkling White Teeth Whitening Toothpaste 140g,$6.00,$4.29 / 100G
Palmolive Naturals Moisture Care Aloe & Olive Extracts Bar Soap 90g X4 Pack,$5.00,$1.39 / 100G
Australian Botanical Soap Lemon Grass 200g,$4.00,$2.00 / 100G
Evamay Tampons Regular 20 Pack,$2.25,$0.11 / 1EA
Strepsils Sore Throat Antibacterial Lozenge Honey & Lemon 16 Pack,$6.00,$0.38 / 1EA
Colgate 360 Advanced Bacteria Removing Action Medium Toothbrush Each,$6.00,$6.00 / 1EA
Tom Organic Super Tampons 2x8 Pack,$4.20,$0.26 / 1EA
Essentials Facial Tissues 224 Pack,$1.70,$0.76 / 100SS
Kleenex Everyday 2 Ply Facial Tissues 200 Pack,$3.00,$1.50 / 100SS
Quilton Facial Tissues Soft White 95 Pack,$1.40,$1.47 / 100SS
Kleenex Aloe Vera & Vitamin E 3 Ply Facial Tissues 95 Pack,$2.60,$2.74 / 100SS
Kleenex Aloe Vera & Vitamin E 3 Ply Facial Tissues 140 Pack,$3.60,$2.57 / 100SS
Symphony Facial Tissues White 228ss 3 Pack,$5.00,$0.73 / 100SS
Kleenex Large & Thick 3 Ply Facial Tissues 95 Pack,$2.80,$2.95 / 100SS
Swisspers Cotton Tips 240 Pack,$4.80,$2.00 / 100EA
Libra Tampons Super 32 Pack,$7.00,$0.22 / 1EA
Evamay Tampons Super 16 Pack,$2.00,$0.13 / 1EA
Tom Organic Tampons Regular 16 Pack,$4.20,$0.26 / 1EA
Oral-b Frozen Kids 3+ Years Toothpaste 92g,$3.50,$3.80 / 100G
Vicks Vaporub Decongestant Rub 50g,$8.00,$16.00 / 100G
Oral-b 3d White Strengthens Enamel Whitening Toothpaste 110g,$5.50,$5.00 / 100G
Icare Everyday Facial Tissue 200 Pack,$2.00,$1.00 / 100SS
No Issues Facial Tissues Single Cube 60 Sheets,$2.00,$3.33 / 100SS
Kleenex Aloe Vera & Vitamin E 4 Ply Pocket Pack Facial Tissues 6 Pack,$3.70,$6.85 / 100SS
Colgate Sensitive Teeth Pain Multi Protection Toothpaste 110g,$9.00,$8.18 / 100G
Cussons Prize Medal Oatmeal Bar Soap 5 Pack,$5.00,$1.11 / 100G
Dettol Sapoderm Hygienic Bar Soap For Acne Prone And Oily Skin 3x375g,$5.00,$1.67 / 1EA
Sensodyne Toothpaste Sensitive Teeth Pain Deep Clean 110g,$9.70,$8.82 / 100G
Balnea Sorbolene Unscented Soap 3x100g,$4.00,$1.33 / 1EA
Rexona Men Antiperspirant Aerosol Deodorant Original 250ml,$6.00,$2.40 / 100ML
U By Kotex Tampons Super Super Bulk 32 Pack,$8.00,$0.25 / 1EA
Palmolive Luminous Oils Moroccan Argan Oil & Camellia Protect Shampoo 350ml,$4.80,$1.37 / 100ML
Colgate Maxfresh Cool Mint Toothpaste 200g,$5.00,$2.50 / 100G
Imperial Leather Original Bar Soap 6 Pack,$4.75,$0.79 / 100G
Sensodyne Toothbrush Sensitive Teeth Daily Care Soft 3 Pack,$10.50,$3.50 / 1EA
Zyrtec Rapid Acting Allergy & Hayfever Antihistamine Tablets 10 Pack,$13.00,$1.30 / 1EA
U By Kotex Tampons Super Super 16 Pack,$3.50,$0.22 / 1EA
U By Kotex Tampons Mini 16 Pack,$3.50,$0.22 / 1EA
Oral-b Star Wars Junior Kids 6+ Toothpaste 92g,$3.50,$3.80 / 100G
Essentials Facial Tissues 224 Pack,$1.70,$0.76 / 100SS
Kleenex Everyday 2 Ply Facial Tissues 200 Pack,$3.00,$1.50 / 100SS
Quilton Facial Tissues Soft White 95 Pack,$1.40,$1.47 / 100SS
Kleenex Aloe Vera & Vitamin E 3 Ply Facial Tissues 95 Pack,$2.60,$2.74 / 100SS
Kleenex Aloe Vera & Vitamin E 3 Ply Facial Tissues 140 Pack,$3.60,$2.57 / 100SS
Symphony Facial Tissues White 228ss 3 Pack,$5.00,$0.73 / 100SS
Kleenex Large & Thick 3 Ply Facial Tissues 95 Pack,$2.80,$2.95 / 100SS
Swisspers Cotton Tips 240 Pack,$4.80,$2.00 / 100EA
Colgate Zig Zag Interdental Clean Soft Manual Toothbrush Value 3 Pack,$7.80,$2.60 / 1EA
Oral-b Pro-health Advanced All Around Protection Toothpaste 110g,$6.00,$5.45 / 100G
Quilton Pocket Packs 4ply Hypo Allergenic 6 Pack,$2.40,$4.00 / 100SS
Priya Soap Bar Goats Milk 100g,$2.50,$2.50 / 100G
Wet Ones Moist Wipes Gentle 15 Pack,$2.20,$0.15 / 1EA
Tampax Regular Tampons Light Flow With Applicator 20 Pack,$5.95,$0.30 / 1EA
All Smiles Total Care Toothbrush Medium 6 Pack,$5.30,$0.88 / 1EA
Colgate Total Advanced Fresh Gel Antibacterial Toothpaste 115g,$6.50,$5.65 / 100G
All Smiles Total Care Toothbrush Soft 6 Pack,$5.30,$0.88 / 1EA
Strepsils Double Antibacterial? Soothing Throat Lozenge Honey And Lemon 36 Pack,$12.00,$0.33 / 1EA
Cashmere Bouquet Bar Soap Lavender 100g X4 Pack,$5.00,$1.25 / 100G
Colgate Total Advanced Whitening Antibacterial Toothpaste 200g,$5.00,$2.50 / 100G
Tom Organic Pads Regular Ultra Thin 10 Pack,$4.20,$0.42 / 1EA
Sunsilk Shampoo Addictive Brilliant Shine 700ml,$12.00,$1.71 / 100ML
Colgate Advanced Whitening Toothpaste 115g,$6.50,$5.65 / 100G
Colgate Optic White Expert High Impact Teeth Whitening Toothpaste 85g,$12.00,$14.12 / 100G
Oral-b 3d White Luxe Glamorous White Fluoride Whitening Toothpaste 95g,$10.00,$10.53 / 100G
Australian Botanical Soap Goats Milk & Raspberry Each,$4.00,$2.00 / 100G
Sensodyne Toothpaste Daily Care + Whitening 2 Pack,$16.50,$7.50 / 100G
Quilton Cooling Lotion 3 Ply Facial Tissue 95 Pack,$2.80,$2.95 / 100SS
Velvet Bar Soap Pure 4 Pack 400g,$4.90,$1.23 / 100G
Tresemme Moisture Rich Shampoo With Vitamin E & Jojoba Oil 940ml,$9.80,$1.04 / 100ML
Colgate Advanced Whitening Toothpaste 200g,$5.00,$2.50 / 100G
Tom Organic Bulk Tampons Regular 32 Pack,$9.90,$0.31 / 1EA
Essentials Facial Tissues 224 Pack,$1.70,$0.76 / 100SS
Kleenex Everyday 2 Ply Facial Tissues 200 Pack,$3.00,$1.50 / 100SS
Quilton Facial Tissues Soft White 95 Pack,$1.40,$1.47 / 100SS
Kleenex Aloe Vera & Vitamin E 3 Ply Facial Tissues 95 Pack,$2.60,$2.74 / 100SS
Kleenex Aloe Vera & Vitamin E 3 Ply Facial Tissues 140 Pack,$3.60,$2.57 / 100SS
Symphony Facial Tissues White 228ss 3 Pack,$5.00,$0.73 / 100SS
Kleenex Large & Thick 3 Ply Facial Tissues 95 Pack,$2.80,$2.95 / 100SS
Swisspers Cotton Tips 240 Pack,$4.80,$2.00 / 100EA
Pantene Pro-v Daily Moisture Renewal Nourishing Shampoo Dry Hair 900ml,$10.00,$1.11 / 100ML
Vicks Vaporub Decongestant Rub 100g,$14.90,$14.90 / 100G
Oc Naturals Shampoo Coco Repair 400ml,$3.70,$0.93 / 100ML
Sensodyne Toothpaste Sensitive Teeth Pain Rapid Relief 100g,$12.30,$12.30 / 100G
Colgate Total Advanced Fresh Gel Antibacterial Toothpaste 200g,$5.00,$2.50 / 100G
Colgate Zig Zag Interdental Clean Soft Manual Toothbrush Value 6 Pack,$9.00,$1.50 / 1EA
Palmolive Antibacterial Liquid Hand Wash Soap Odour Neutralising 250ml,$1.50,$0.60 / 100ML
Oc Naturals Shampoo Normal Balance 725ml,$6.40,$0.88 / 100ML
U By Kotex Sport Tampons Regular Regular 16 Pack,$4.13,$0.26 / 1EA
Stayfree Ultra Thin Super Pads With Wings 12 Pack,$4.20,$0.35 / 1EA
Australian Botanical Soap Sea Salt 200g,$4.00,$2.00 / 100G
Sensodyne Gum Dual Action Extra Fresh Toothpaste 100g,$12.30,$12.30 / 100G
Colgate Blue Minty Gel For Cavity Protection 165g,$3.50,$2.12 / 100G
Sunsilk Shampoo Addictive Brilliant Shine 350ml,$6.50,$1.86 / 100ML
Vicks Vapodrops Throat Lozenges Original 42 Pack,$7.65,$0.18 / 1EA
Oral-b Gum Care & Enamel Restore Fluoride Toothpaste Mint 110g,$10.00,$9.09 / 100G
Sunsilk Biotin Conditioner For Longer & Stronger Hair 700ml,$12.00,$1.71 / 100ML
Colgate Sensitive Pro-relief Enamel Repair Teeth Pain Toothpaste 110g,$5.50,$5.00 / 100G
Oc Naturals Conditioner Normal Balance 400ml,$3.70,$0.93 / 100ML
Colgate Zig Zag Interdental Clean Medium Manual Toothbrush Value 3 Pack,$7.80,$2.60 / 1EA
Colgate Slim Soft Charcoal Infused Bristles Toothbrush Soft 1 Pack,$3.00,$3.00 / 1EA
Australian Botanical Soap Goats Milk 200g,$4.00,$2.00 / 100G
Swisspers Cotton Tips 240 Pack,$4.80,$2.00 / 100EA
Natures Organics Fruits Conditioner Restore Coconut Lime 500ml,$2.00,$0.40 / 100ML
Essentials Facial Tissues 224 Pack,$1.70,$0.76 / 100SS
Kleenex Everyday 2 Ply Facial Tissues 200 Pack,$3.00,$1.50 / 100SS
Quilton Facial Tissues Soft White 95 Pack,$1.40,$1.47 / 100SS
Kleenex Aloe Vera & Vitamin E 3 Ply Facial Tissues 95 Pack,$2.60,$2.74 / 100SS
Kleenex Aloe Vera & Vitamin E 3 Ply Facial Tissues 140 Pack,$3.60,$2.57 / 100SS
Symphony Facial Tissues White 228ss 3 Pack,$5.00,$0.73 / 100SS
Kleenex Large & Thick 3 Ply Facial Tissues 95 Pack,$2.80,$2.95 / 100SS
Swisspers Cotton Tips 240 Pack,$4.80,$2.00 / 100EA
Nivea Crème Soft Care Body Soap Twin Pack 100g X 2 Pack,$4.50,$2.25 / 100G
Swisspers Cotton Large Make Up Pads 50 Pack,$4.00,$0.08 / 1EA
Kleenex Anti-bacterial To-go Wipes Wet Wipes 15 Pack,$2.50,$0.17 / 1EA
Tom Organic Pads Super Ultra Thin 10 Pack,$4.20,$0.42 / 1EA
Sunsilk Biotin Shampoo Longer & Stronger 350ml,$6.50,$1.86 / 100ML
Dettol Instant Hand Sanitiser Instant Hand Sanitizer Refresh 500ml,$14.95,$2.99 / 100ML
Oscar Orsen Tweezers Slant Tip Each,$4.00,$4.00 / 1EA
Freshwater Farm Australia Lemon Myrtle Oil + Manuka Honey Soothing Body Bar 200g,$4.50,$2.25 / 100G
Stayfree Ultra Thin All Nights Pads With Wings 10 Pack,$4.20,$0.42 / 1EA
Pantene Daily Moisture Renewal Nourishing Shampoo 375ml,$5.00,$1.33 / 100ML
All Smiles Toothbrush Kids Soft 5 Pack 5 Pack,$5.00,$1.00 / 1EA
Colgate Kids Minions Toothbrush Extra Soft Bristles 6+ Years 2 Pack,$7.00,$3.50 / 1EA
Stayfree Ultra Thin Regular Pads With Wings 14 Pack,$4.20,$0.30 / 1EA
Tom Organic Ultra Thin Liners 26 Pack,$4.20,$0.16 / 1EA
Voeu Cleansing Facial Wipes 30 Pack,$1.80,$0.06 / 1EA
Freshwater Farm Australia Rosewater & Pink Clay Cleansing Bar 200g,$4.50,$2.25 / 100G
Sukin Signature Foaming Facial Cleanser Pump 125ml,$7.50,$6.00 / 100ML
Vicks Nasal Decongestant Inhaler 0.5ml,$8.00,$8.00 / 1EA
Palmolive Foaming Liquid Hand Wash Soap Japanese Cherry Blossom 250ml,$2.00,$0.80 / 100ML
Oral-b Stages 2 Kids Toothbrush 2-4 2-4 Years Winnie The Pooh Each,$3.55,$3.55 / 1EA
Oral-b Complete 5 Way Clean Toothbrush Med Each,$4.00,$4.00 / 1EA
Dettol Liquid Antibacterial Instant Hand Sanitiser Refresh 50ml,$1.75,$3.50 / 100ML
Gillette Venus Sensitive Disposable Razors 3 Pack,$11.00,$3.67 / 1EA
Palmolive Antibacterial Liquid Hand Wash Soap Pump Orange 250ml,$1.50,$0.60 / 100ML
Essentials Facial Tissues 224 Pack,$1.70,$0.76 / 100SS
Kleenex Everyday 2 Ply Facial Tissues 200 Pack,$3.00,$1.50 / 100SS
Quilton Facial Tissues Soft White 95 Pack,$1.40,$1.47 / 100SS
Kleenex Aloe Vera & Vitamin E 3 Ply Facial Tissues 95 Pack,$2.60,$2.74 / 100SS
Kleenex Aloe Vera & Vitamin E 3 Ply Facial Tissues 140 Pack,$3.60,$2.57 / 100SS
Symphony Facial Tissues White 228ss 3 Pack,$5.00,$0.73 / 100SS
Kleenex Large & Thick 3 Ply Facial Tissues 95 Pack,$2.80,$2.95 / 100SS
Swisspers Cotton Tips 240 Pack,$4.80,$2.00 / 100EA
Ecostore Lemongrass Soap Bar 150g,$4.00,$2.67 / 100G
Strepsils Double Antibacterial Soothing Sore Throat Lozenges Orange 16 Pack,$6.00,$0.38 / 1EA
U By Kotex Sport Tampons Super Super 16 Pack,$4.13,$0.26 / 1EA
Tresemme Cleanse & Replenish Shampoo 940ml,$9.80,$1.04 / 100ML
Nad's Hair Removal Wax Facial Strips 16 Pack,$8.40,$0.53 / 1EA
Dettol Liquid Antibacterial Instant Hand Sanitiser Refresh 200ml,$7.50,$3.75 / 100ML
Voltaren Muscle And Back Pain Relief Emulgel 100g,$18.00,$18.00 / 100G
Colgate 2 In 1 Toothpaste & Mouthwash Whitening Liquid Gel 130g,$6.50,$5.00 / 100G
Oral-b 3d White Long Last Fresh Toothpaste 110g,$5.50,$5.00 / 100G
Garnier Fructis Normal Strength & Shine Shampoo 315ml,$5.60,$1.78 / 100ML
Voeu Micellar Cleansing Wipes 30 Pack,$1.80,$0.06 / 1EA
Strepsils Plus Anaesthetic Sore Throat Numbing Pain Relief Lozenges 16 Pack,$8.00,$0.50 / 1EA
Swisspers Paper Cotton Stems 400 Pack,$6.80,$0.02 / 1EA
Telfast Hayfever Allergy Relief 120mg Antihistamine Tablets 10 Pack,$12.60,$1.26 / 1EA
Tresemme Moisture Rich Conditioner With Vitamin E & Jojoba Oil 940ml,$9.80,$1.04 / 100ML
Sukin Signature Scent Botanical Body Wash Pump 1l,$13.00,$1.30 / 100ML
Vicks Vapodrops Throat Lozenges Butter Menthol 42 Pack,$7.65,$18.21 / 100EA
Colgate Total 12 Sensitivity + Gum Health Toothpaste 115g,$6.50,$5.65 / 100G
Sunsilk Conditioner Addictive Brilliant Shine 700ml,$12.00,$1.71 / 100ML
Steradent Denture Care Tablets Extra Strength 30 Pack,$6.40,$0.21 / 1EA
Dove Beauty Cream Bar Original Soap 90g X 2 Pack,$4.20,$2.33 / 100G
Selsun Blue Anti Dandruff Shampoo Replenishing 200ml,$5.50,$2.75 / 100ML
Nivea Rich Nourishing Body Lotion Deep Moisturiser For Dry Skin 400ml,$5.70,$1.43 / 100ML
Essentials Facial Tissues 224 Pack,$1.70,$0.76 / 100SS
Kleenex Everyday 2 Ply Facial Tissues 200 Pack,$3.00,$1.50 / 100SS
Quilton Facial Tissues Soft White 95 Pack,$1.40,$1.47 / 100SS
Kleenex Aloe Vera & Vitamin E 3 Ply Facial Tissues 95 Pack,$2.60,$2.74 / 100SS
Kleenex Aloe Vera & Vitamin E 3 Ply Facial Tissues 140 Pack,$3.60,$2.57 / 100SS
Symphony Facial Tissues White 228ss 3 Pack,$5.00,$0.73 / 100SS
Kleenex Large & Thick 3 Ply Facial Tissues 95 Pack,$2.80,$2.95 / 100SS
Swisspers Cotton Tips 240 Pack,$4.80,$2.00 / 100EA
All Smiles Herbal Toothpaste 110g,$1.70,$1.55 / 100G
Sukin Hydrating Shampoo 500ml,$9.50,$1.90 / 100ML
Libra Tampons Girl Regular 16 Pack,$3.00,$0.19 / 1EA
Redwin Anti Dandruff Shampoo Tea Tree Treatment 250ml,$5.50,$2.20 / 100ML
Rexona Women Antiperspirant Aerosol Deodorant Sexy Bouquet 250ml,$6.00,$2.40 / 100ML
Dove Original Beauty Cream Soap Bars 90g X 4 Pack,$4.50,$1.25 / 100G
Tena Pads Maxi Night 14 Pack,$10.00,$0.71 / 1EA
Pears Soap Bar Transparent 3x125g,$7.20,$1.92 / 100G
Dettol 2 In 1 Hands And Surfaces Antibacterial Wipes 15 Pack,$3.00,$0.20 / 1EA
Strepsils Soothing Sore Throat Lozenges Honey & Lemon 48 Pack,$13.50,$0.28 / 1EA
Gillette Venus Comfortglide White Tea Disposable Razor 2 Pack,$10.00,$5.00 / 1EA
Woolworths Kids Sunscreen Spf 50+ Roll On 75ml,$6.00,$8.00 / 100ML
Sunsilk Conditioner Addictive Brilliant Shine 350ml,$6.50,$1.86 / 100ML
Cancer Council Kid Sunscreen Spf50+ 500ml,$29.00,$5.80 / 100ML
Colgate Optic White Enamel Care Teeth Whitening Toothpaste 140g,$6.00,$4.29 / 100G
Telfast Hayfever Allergy Relief 180mg Antihistamine Tablets 5 Pack,$8.40,$1.68 / 1EA
Tom Organic Overnight Pads 8 Pack,$4.60,$0.58 / 1EA
Palmolive Luminous Oils Moroccan Argan Oil Camellia Hair Conditioner 350ml,$4.80,$1.37 / 100ML
Sundae Vanilla Bean Whipped Shower Foam 265ml,$13.40,$5.06 / 100ML
Oc Naturals Conditioner Coco Repair 400ml,$3.70,$0.93 / 100ML
Colgate 360 Sensitive Pro-relief Teeth Pain Toothbrush Extra Soft 2 Pack,$4.00,$2.00 / 1EA
Nivea Sun Protect & Moisture Sunscreen Lotion Spf50+ 100ml,$14.00,$14.00 / 100ML
Colgate Nature's Extracts Charcoal Mint Toothpaste 100g,$4.00,$4.00 / 100G
Cottons Organic Tampons Regular 16 Pack,$3.85,$0.24 / 1EA
Essentials Facial Tissues 224 Pack,$1.70,$0.76 / 100SS
Kleenex Everyday 2 Ply Facial Tissues 200 Pack,$3.00,$1.50 / 100SS
Quilton Facial Tissues Soft White 95 Pack,$1.40,$1.47 / 100SS
Kleenex Aloe Vera & Vitamin E 3 Ply Facial Tissues 95 Pack,$2.60,$2.74 / 100SS
Kleenex Aloe Vera & Vitamin E 3 Ply Facial Tissues 140 Pack,$3.60,$2.57 / 100SS
Symphony Facial Tissues White 228ss 3 Pack,$5.00,$0.73 / 100SS
Kleenex Large & Thick 3 Ply Facial Tissues 95 Pack,$2.80,$2.95 / 100SS
Swisspers Cotton Tips 240 Pack,$4.80,$2.00 / 100EA
Pantene Shampoo Daily Moisture 90ml,$3.00,$3.33 / 100ML
Jack N' Jill Natural Toothpaste Strawberry 50g,$7.50,$15.00 / 100G
Salvital Salts Saline 375g,$7.20,$1.92 / 100G
Strepsils Sore Throat Sugar Free Strawberry Lozenges 36 Pack,$10.00,$0.28 / 1EA
Rexona Men Advanced Sport Anti Perspirant Aerosol Deodorant 220ml,$9.50,$4.32 / 100ML
Red Seal Baking Soda Toothpaste 100g,$3.60,$3.60 / 100G
Tom Organic Tampons Mini 16 Pack,$4.20,$0.26 / 1EA
Sunsilk Biotin Conditioner Longer & Stronger 350ml,$6.50,$1.86 / 100ML
Telfast Hayfever Allergy Relief 60mg Antihistamine Tablets 20 Pack,$12.60,$0.63 / 1EA
Head & Shoulders Clean & Balanced Anti Dandruff Shampoo For Clean Scalp 660ml,$21.00,$3.18 / 100ML
Sunsilk Conditioner Soft & Smooth 700ml,$12.00,$1.71 / 100ML
Cottons Organic Tampons Super 16 Pack,$3.85,$0.24 / 1EA
Freshwater Farm Australia Mandarin + Cedarwood Oil Revitalising Body Bar 200g,$4.50,$2.25 / 100G
Vicks Vapodrop Throat Lozenges Original 24 Pack,$5.90,$0.25 / 1EA
Dettol Citrus Fresh Bar Soap 3 Pack,$4.90,$1.63 / 100G
