Product Name,Price,Price per Unit
Sukin Haircare Deep Cleanse Conditioner 500ml,$9.50,$1.90 / 100ML
Band-aid First Aid Non-irritating Paper Tape 2.5cm X 9.1m Each,$7.50,$0.82 / 1M
Gillette Venus Smooth Razor Blades 8 Pack,$30.50,$3.81 / 1EA
Schick Razor Quattro For Women + 2 Blades Each,$5.95,$5.95 / 1EA
Essentials Facial Tissues 224 Pack,$1.70,$0.76 / 100SS
Kleenex Everyday 2 Ply Facial Tissues 200 Pack,$3.00,$1.50 / 100SS
Quilton Facial Tissues Soft White 95 Pack,$1.40,$1.47 / 100SS
Kleenex Aloe Vera & Vitamin E 3 Ply Facial Tissues 95 Pack,$2.60,$2.74 / 100SS
Kleenex Aloe Vera & Vitamin E 3 Ply Facial Tissues 140 Pack,$3.60,$2.57 / 100SS
Symphony Facial Tissues White 228ss 3 Pack,$5.00,$0.73 / 100SS
Kleenex Large & Thick 3 Ply Facial Tissues 95 Pack,$2.80,$2.95 / 100SS
Swisspers Cotton Tips 240 Pack,$4.80,$2.00 / 100EA
L'oreal Elvive Extraordinary Oil Shampoo 300ml,$8.50,$2.83 / 100ML
U By Kotex Designer Series Liners Protect Liners 30 Pack,$2.94,$0.10 / 1EA
Tresemme Length Protect Conditioner Biotin Coconut & Jojoba Oils 940ml,$9.80,$1.04 / 100ML
"Sukin Anna Cole Body Wash Rosehip, Jojoba & Avocado Oils 500ml",$5.50,$1.10 / 100ML
Nyal Gentle Relief Saline 30ml,$10.00,$33.33 / 100ML
Simple Biodegradable Facial Wipes 25 Pack,$6.30,$0.25 / 1EA
Betadine Sore Throat Lozenges Anaesthetic Honey & Lemon 36 Pack,$10.00,$0.28 / 1EA
Nivea Sun Protect & Moisture Lock Sunscreen Spray Spf30 200ml,$22.00,$11.00 / 100ML
Pantene Pro-v Smooth & Sleek Shampoo For Frizzy Hair 375ml,$5.00,$1.33 / 100ML
Bondi Sands Tanning Gradual Tan 375ml,$14.00,$3.73 / 100ML
Dove Go Fresh Body Wash Pomegranate & Lemon Verbena Scent 1l,$17.00,$1.70 / 100ML
Mcobeauty Xtendlash Each,$28.00,$40.00 / 10ML
Quick-eze Heartburn & Indigestion Relief Chewy Peppermint 24 Pack,$7.50,$0.31 / 1EA
Voeu Toner With Witch Hazel 200ml,$6.00,$3.00 / 100ML
Veet In Shower Hair Removal Cream Sensitive 150g,$11.20,$7.47 / 100G
Bic 1 Sensitive Disposable Razor 10 Pack,$4.50,$0.45 / 1EA
Hawaiian Tropic Tropic Silk Hydration Sunscreen Lotion Spf 50 180ml,$19.00,$10.56 / 100ML
Rexona Women Clinical Protection Antiperspirant Cream Deodorant 45ml,$14.00,$31.11 / 100ML
Schick Xtreme 3 Sensitive Disposable Razors 14 Pack,$14.00,$1.00 / 1EA
Head & Shoulders Supreme Moisture Anti Dandruff Shampoo 550ml,$20.00,$3.64 / 100ML
Head & Shoulders Ultramen Old Spice 2in1 Dandruff Shampoo & Conditioner 550ml,$20.00,$3.64 / 100ML
U By Kotex Sport Ultrathin Pads Super With Wings 10 Pack,$3.92,$0.39 / 1EA
Schwarzkopf Extra Care Ultimate Repair Strengthening Treatment Mask 300ml,$13.00,$4.33 / 100ML
Essentials Facial Tissues 224 Pack,$1.70,$0.76 / 100SS
Kleenex Everyday 2 Ply Facial Tissues 200 Pack,$3.00,$1.50 / 100SS
Quilton Facial Tissues Soft White 95 Pack,$1.40,$1.47 / 100SS
Kleenex Aloe Vera & Vitamin E 3 Ply Facial Tissues 95 Pack,$2.60,$2.74 / 100SS
Kleenex Aloe Vera & Vitamin E 3 Ply Facial Tissues 140 Pack,$3.60,$2.57 / 100SS
Symphony Facial Tissues White 228ss 3 Pack,$5.00,$0.73 / 100SS
Kleenex Large & Thick 3 Ply Facial Tissues 95 Pack,$2.80,$2.95 / 100SS
Swisspers Cotton Tips 240 Pack,$4.80,$2.00 / 100EA
Vicks Insight Thermometer Each,$26.50,$26.50 / 1EA
Garnier Fructis Nutri-repair 3 Shampoo 315ml,$5.60,$1.78 / 100ML
Herbal Essences Bio:renew Coconut Milk Hydrating Shampoo 400ml,$13.50,$3.38 / 100ML
Nivea Rich Lather Coconut & Jojoba Oil Body Wash & Shower Gel 1l,$11.90,$1.19 / 100ML
Colgate Optic White Pro Series Teeth Whitening Toothpaste 80g,$20.00,$25.00 / 100G
Tena Discreet Underwear Black Pants Medium 10 Pack,$17.60,$17.60 / 1EA
Pantene Pro-v Colour Protection Shampoo For Coloured Hair 375ml,$5.00,$1.33 / 100ML
Glow Lab Hydrating Shampoo 600ml,$16.50,$2.75 / 100ML
Sukin Natural Balance Scalp Scrub 200ml,$10.00,$5.00 / 100ML
Head & Shoulders Clean & Balanced Anti Dandruff Shampoo  For Clean Scalp 200ml,$8.00,$4.00 / 100ML
Vo5 Frizz Free Smoothing Cream 125ml,$6.00,$4.80 / 100ML
Dettol Instant Hand Sanitiser Refresh With Aloe Vera Clip On 50ml,$4.00,$8.00 / 100ML
Palmolive Naturals Body Wash Mild & Sensitive Shower Gel 1l,$10.00,$1.00 / 100ML
Vo5 Styling Gel Tub Mega Hold 250g,$4.50,$1.80 / 100G
Neutrogena Night Calming Makeup Remover Cleansing Wipes 25 Pack,$8.50,$0.34 / 1EA
Quick-eze Antacids Peppermint Chewy 8 Pack,$3.00,$0.38 / 1EA
Tresemme Hair Spray Extra Hold Salon Finish 75g,$4.50,$6.00 / 100G
Colgate Plax Antibacterial Mouthwash Freshmint Alcohol Free 500ml,$3.50,$0.70 / 100ML
Rexona For Men Clinical Protection Antiperspirant Deodorant Sport 45ml,$14.00,$31.11 / 100ML
Hawaiian Tropic Island Sport Sunscreen Lotion Spf 50+ Sweat Resistant 180ml,$19.00,$10.56 / 100ML
Palmolive Instant Antibacterial Hand Sanitiser Mint & Eucalyptus 950ml,$18.00,$1.89 / 100ML
Palmolive Men Body Wash Active Shower Gel 1l,$10.00,$1.00 / 100ML
Gillette Venus Deluxe Smooth Sensitive Razor With 2 Razor Blades Each,$20.00,
Gillette Fusion 5 Manual Mens Shaving Razor Each,$20.00,$20.00 / 1EA
Essentials Facial Tissues 224 Pack,$1.70,$0.76 / 100SS
Kleenex Everyday 2 Ply Facial Tissues 200 Pack,$3.00,$1.50 / 100SS
Quilton Facial Tissues Soft White 95 Pack,$1.40,$1.47 / 100SS
Kleenex Aloe Vera & Vitamin E 3 Ply Facial Tissues 95 Pack,$2.60,$2.74 / 100SS
Kleenex Aloe Vera & Vitamin E 3 Ply Facial Tissues 140 Pack,$3.60,$2.57 / 100SS
Symphony Facial Tissues White 228ss 3 Pack,$5.00,$0.73 / 100SS
Kleenex Large & Thick 3 Ply Facial Tissues 95 Pack,$2.80,$2.95 / 100SS
Swisspers Cotton Tips 240 Pack,$4.80,$2.00 / 100EA
Piksters Eco Plastic Free Comfort Grip Soft Toothbrush 2 Pack,$6.30,$3.15 / 1EA
Dove Intensive Repair Shampoo With Smart Target Technology 820ml,$17.00,$2.07 / 100ML
Rexona Woman Antiperspirant Aerosol Deodorant Apple Splash Scent 220ml,$9.50,$4.32 / 100ML
U By Kotex Sport Ultrathin Pads Regular With Wings 12 Pack,$3.92,$0.33 / 1EA
Sukin Botanical Body Wash Reef Aid Sea Breeze 500ml,$5.50,$1.10 / 100ML
Nivea Soft Moisturiser For Face And Body Mini Tub 50ml,$4.00,$8.00 / 100ML
Colgate 360 Advanced Toothbrush Medium 4 Pack,$9.00,$2.25 / 1EA
Ogx Argan Oil Shampoo For Dry & Damaged Hair 385ml,$11.50,$2.99 / 100ML
Schick Hydro 5 Blades With Gel 8 Pack,$42.00,$5.25 / 1EA
Sukin Volumising Conditioner 1l,$23.00,$2.30 / 100ML
Rexona Women Deodorant Antiperspirant Stick Invisible Dry 42g,$4.85,$11.55 / 100G
Schmidt's Certified Natural Deodorant Bergamot & Lime Stick 75g,$14.00,$18.67 / 100G
Tresemme Hair Spray Extra Hold Salon Finish 360g,$9.00,$2.50 / 100G
Colgate Advanced Whitening Purple Toothpaste 120g,$5.00,$4.17 / 100G
Oral-b Pro 800 Electric Toothbrush Each,$100.00,$100.00 / 1EA
Dove Men+care Clean Comfort Anti Perspirant Aerosol Deodorant 254ml,$8.50,$3.35 / 100ML
Toni & Guy Purple Shampoo 250ml,$9.50,$3.80 / 100ML
Bosisto's Eucalyptus Spray 225g,$9.60,$4.27 / 100G
Colgate Total Plaque Release Toothpaste Fragrant Mint 95g,$5.00,$5.26 / 100G
Oral-b Electric Toothbrush Precision Replacement Electric Heads 5 Pack,$38.00,$7.60 / 1EA
Toni & Guy Strength Plex Bond Repair Shampoo 600ml,$15.00,$2.50 / 100ML
Provoke Touch Of Silver Daily Maintenance Purple Shampoo 400ml,$10.00,$2.50 / 100ML
Oral-b 3d White Toothbrush Soft 2 Pack,$9.00,$4.50 / 1EA
Essentials Facial Tissues 224 Pack,$1.70,$0.76 / 100SS
Kleenex Everyday 2 Ply Facial Tissues 200 Pack,$3.00,$1.50 / 100SS
Quilton Facial Tissues Soft White 95 Pack,$1.40,$1.47 / 100SS
Kleenex Aloe Vera & Vitamin E 3 Ply Facial Tissues 95 Pack,$2.60,$2.74 / 100SS
Kleenex Aloe Vera & Vitamin E 3 Ply Facial Tissues 140 Pack,$3.60,$2.57 / 100SS
Symphony Facial Tissues White 228ss 3 Pack,$5.00,$0.73 / 100SS
Kleenex Large & Thick 3 Ply Facial Tissues 95 Pack,$2.80,$2.95 / 100SS
Swisspers Cotton Tips 240 Pack,$4.80,$2.00 / 100EA
Pantene Pro-v Classic Clean Conditioner 375ml,$5.00,$1.33 / 100ML
Oscar Orsen Hair Scissors Each,$10.00,$10.00 / 1EA
Rexona Men Advanced Protection Anti Perspirant Aerosol Coconut 220ml,$9.50,$4.32 / 100ML
Oral-b Vitality Kids  Power 5+ Years Electric Toothbrush Each,$50.00,$50.00 / 1EA
Nivea Men Sensitive Shave Foam With 5 In 1 Protection 200ml,$7.00,$3.50 / 100ML
Oral-b Fresh Clean Toothbrush Soft 7 Pack,$10.00,$1.43 / 1EA
Thanks To Nature Hydrate & Nourish Shampoo With Abyssinian Oil 500ml,$9.00,$1.80 / 100ML
Palmolive Luminous Oils Moroccan Argan Oil & Camellia Shampoo 700ml,$10.00,$1.43 / 100ML
Schwarzkopf Extra Care Supreme Length Fortifying Conditioner 400ml,$9.00,$2.25 / 100ML
Funtime Kids Bubble Bath Space Bubbles 1l,$2.50,$0.25 / 100ML
Sukin Hydrating Body Lotion Coconut & Pineapple 500ml,$8.00,$1.60 / 100ML
Dove Intensive Repair Conditioner With Smart Target Technology 320ml,$7.70,$2.41 / 100ML
U By Kotex Ultrathin Overnight Pads With Wings 10 Pack,$3.50,$0.35 / 1EA
Rexona Womens Antiperspirant Aerosol Clinical Protection Deodorant 180ml,$12.00,$6.67 / 100ML
U By Kotex Extra Overnight Pads Long With Wings 8 Pack,$3.50,$0.44 / 1EA
Clairol Nice N Easy Root Touch-up 5 Medium Brown Each,$10.00,$10.00 / 1EA
Dove Deodorant Roll On Cucumber & Green Tea Zero Aluminum 50ml,$4.50,$9.00 / 100ML
Garnier Fructis Normal Strength & Shine Conditioner 850ml,$11.90,$1.40 / 100ML
Palmolive Foaming Liquid Hand Wash Soap Pump Raspberry 250ml,$2.00,$0.80 / 100ML
Balnea Lime Antibacterial Hand Wash 250ml,$2.40,$0.96 / 100ML
"Pantene Pro-v Long & Strong Shampoo For Dry, Damaged Hair 375ml",$5.00,$1.33 / 100ML
Vitaustralia Emu Oil Cream 250g,$3.85,$1.54 / 100G
Oral B Kids Frozen Toothpaste 92g,$3.50,$3.80 / 100G
Pantene Pro-v  Sheer Volume Conditioner For Fine Hair 375ml,$5.00,$1.33 / 100ML
Essentials Facial Tissues 224 Pack,$1.70,$0.76 / 100SS
Kleenex Everyday 2 Ply Facial Tissues 200 Pack,$3.00,$1.50 / 100SS
Quilton Facial Tissues Soft White 95 Pack,$1.40,$1.47 / 100SS
Kleenex Aloe Vera & Vitamin E 3 Ply Facial Tissues 95 Pack,$2.60,$2.74 / 100SS
Kleenex Aloe Vera & Vitamin E 3 Ply Facial Tissues 140 Pack,$3.60,$2.57 / 100SS
Symphony Facial Tissues White 228ss 3 Pack,$5.00,$0.73 / 100SS
Kleenex Large & Thick 3 Ply Facial Tissues 95 Pack,$2.80,$2.95 / 100SS
Swisspers Cotton Tips 240 Pack,$4.80,$2.00 / 100EA
Impulse Women Aerosol Body Spray Deodorant Romantic Spark 75ml,$4.20,$5.60 / 100ML
Colgate 360 Charcoal Spiral Toothbrush Soft 3 Pack,$6.00,$2.00 / 1EA
"Simple 10% Vitamins C, E & F Booster Serum 30ml",$14.00,$46.67 / 100ML
Vitaustralia Lanolin Oil Cream 250g,$3.85,$1.54 / 100G
Schwarzkopf Extra Care Aqua Revive Moisturising Shampoo 400ml,$9.00,$2.25 / 100ML
Balnea Original Antibacterial Hand Wash Refill 1l,$3.50,$0.35 / 100ML
Gillette Sensor3 Comfort Shaving Razor 8 Pack,$13.50,$1.69 / 1EA
Tena Discreet Underwear Black Pants Large 9 Pack,$17.60,$17.60 / 1EA
Vaseline Lip Therapy Original 4.8g,$4.50,$93.75 / 100G
L'oreal Elvive Extraordinary Oil Coconut Conditioner 300ml,$8.50,$2.83 / 100ML
Sukin Volumising Conditioner 500ml,$9.50,$1.90 / 100ML
Trishave 3in1 Shave Creme For Women 100g,$7.25,$7.25 / 100G
Hello Kids Toothpaste Unicorn Sparkle Bubble Gum Ages 7-107 119g,$5.00,$4.20 / 100G
Difflam Plus Sore Throat Lozenges + Anaesthetic Berry 16 Pack,$8.00,$0.50 / 1EA
Toni & Guy Purple Shampoo 600ml,$15.00,$2.50 / 100ML
Evamay Pads With Wings Regular 16 Pack,$2.20,$0.14 / 1EA
Dettol 2 In 1 Hands And Surfaces Antibacterial Wipes 60 Pack,$8.50,$0.14 / 1EA
Oral-b Pro 100 Floss Action Electric Toothbrush Each,$80.00,$80.00 / 1EA
Gillette Blue Ii Disposable Shaving Razor Plus 20 Pack,$20.00,$1.00 / 1EA
Rexona Men Clinical Roll On Sport 50ml,$8.00,$16.00 / 100ML
Bondi Sands Spf50+ Face Lotion 75ml,$10.50,$14.00 / 100ML
Palmolive Body Wash Coconut Scrub Exfoliating Shower Gel 400ml,$4.50,$1.13 / 100ML
Rexona Men Advanced Protection Lemon Crush Antiperspirant 220ml,$9.50,$4.32 / 100ML
Dettol Profresh Shower Gel Body Wash Lemon And Lime 950ml,$10.50,$1.11 / 100ML
Essentials Facial Tissues 224 Pack,$1.70,$0.76 / 100SS
Kleenex Everyday 2 Ply Facial Tissues 200 Pack,$3.00,$1.50 / 100SS
Quilton Facial Tissues Soft White 95 Pack,$1.40,$1.47 / 100SS
Kleenex Aloe Vera & Vitamin E 3 Ply Facial Tissues 95 Pack,$2.60,$2.74 / 100SS
Kleenex Aloe Vera & Vitamin E 3 Ply Facial Tissues 140 Pack,$3.60,$2.57 / 100SS
Symphony Facial Tissues White 228ss 3 Pack,$5.00,$0.73 / 100SS
Kleenex Large & Thick 3 Ply Facial Tissues 95 Pack,$2.80,$2.95 / 100SS
Swisspers Cotton Tips 240 Pack,$4.80,$2.00 / 100EA
Palmolive Naturals Intensive Moisture Conditioner Coconut Cream 350ml,$6.00,$1.71 / 100ML
Provoke Touch Of Silver Brightening Purple Shampoo 200ml,$13.00,$6.50 / 100ML
Dove Nourishing Secrets Destress Ritual Shampoo 320ml,$7.70,$2.41 / 100ML
L'oreal Elvive Total Repair 5 Repairing Conditioner 300ml,$8.50,$2.83 / 100ML
Libra Maternity Pads Aloe Vera With Wings 10 Pack,$3.50,$0.35 / 1EA
Skyn Condoms Skyn Large 10 Pack,$9.50,$0.95 / 1EA
Palmolive Naturals Body Wash Milk & Honey Shower Gel 500ml,$6.50,$1.30 / 100ML
Sensodyne Complete Care Cool Mint 100g,$12.30,$12.30 / 100G
Oral-b Essential Waxed Dental Floss Mint 50m,$3.20,$0.06 / 1M
Palmolive Naturals Body Wash Orchid Shower Gel 1l,$10.00,$1.00 / 100ML
Reef Tanning Spf 15+ Coconut Sun Tan Oil Sunscreen 125ml,$14.00,$11.20 / 100ML
Clairol Nice N Easy Root Touch-up 4 Dark Brown Each,$10.00,$10.00 / 1EA
Robitussin Cough Syrups Cold & Chesty Cough 200ml,$12.00,$6.00 / 100ML
Veet Sugar Warm Wax Kit Argan Oil 360g,$12.00,$3.33 / 100G
Schwarzkopf Taft Hair Gel Maximum Hold 250g,$6.00,$2.40 / 100G
Skyn Maxium Performance Lubricant 80ml,$11.00,$13.75 / 100ML
Dove Nourishing Moisture Shampoo With Pro Moisture Complex 820ml,$17.00,$2.07 / 100ML
Gillette Venus With Olay Comfortglide Sugarberry Razor Blades 5 Pack,$29.50,$7.38 / 1EA
Garnier Fructis Coconut Water Shampoo Shampoo 850ml,$11.90,$1.40 / 100ML
Oh So Comfy Mini Scrunchies 4 Pack,$6.00,
Bic Soleil Sensitive Advanced Disposable Razors 2 Pack,$7.70,$3.85 / 1EA
Colgate Plax Antibacterial Mouthwash Freshmint Alcohol Free 250ml,$4.50,$1.80 / 100ML
Simple 10% Vitamin B3 Niacinamide Booster Serum 30ml,$14.00,$46.67 / 100ML
Essentials Facial Tissues 224 Pack,$1.70,$0.76 / 100SS
Kleenex Everyday 2 Ply Facial Tissues 200 Pack,$3.00,$1.50 / 100SS
Quilton Facial Tissues Soft White 95 Pack,$1.40,$1.47 / 100SS
Kleenex Aloe Vera & Vitamin E 3 Ply Facial Tissues 95 Pack,$2.60,$2.74 / 100SS
Kleenex Aloe Vera & Vitamin E 3 Ply Facial Tissues 140 Pack,$3.60,$2.57 / 100SS
Symphony Facial Tissues White 228ss 3 Pack,$5.00,$0.73 / 100SS
Kleenex Large & Thick 3 Ply Facial Tissues 95 Pack,$2.80,$2.95 / 100SS
Swisspers Cotton Tips 240 Pack,$4.80,$2.00 / 100EA
Schick Hydro Shave Gel Sensitive 198g,$7.00,$3.54 / 100G
Garnier Fructis Nutri-repair 3 Shampoo 850ml,$11.90,$1.40 / 100ML
Freshwater Farm Australia Tea Tree + Eucalyptus Oil Hand Sanitiser Gel 500ml,$7.50,$1.50 / 100ML
Gillette Venus For Pubic Hair & Skin Razor Blades 3 Pack,$23.00,$23.00 / 1EA
Evamay Pads With Wings Night 12 Pack,$2.20,$0.18 / 1EA
Poise Pads For Bladder Leaks Extra Plus 20 Pack,$11.80,$0.59 / 1EA
Dove Restoring Ritual Conditioner With Coconut Oil 320ml,$7.70,$2.41 / 100ML
Mcobeauty Slant Tip Precision Tweezers Each,$10.00,
Oral-b Fresh Clean Toothbrush Medium 7 Pack,$10.00,$1.43 / 1EA
Oral-b Kids Vitality Power Electric Toothbrush Heads 2 Pack,$16.00,$8.00 / 1EA
U By Kotex Sport Liners Sport Liners 30 Pack,$2.94,$0.10 / 1EA
Invisible Zinc Sheer Defence Spf 50 Tinted Moisturiser Sunscreen Light 50g,$27.20,$54.40 / 100G
All Smiles Total Care Mint Mouthwash 500ml,$2.00,$0.40 / 100ML
Schwarzkopf Extra Care Colour Perfector Protecting Shampoo 950ml,$19.00,$2.00 / 100ML
Herbal Essences Conditioner Colour Me Happy 300ml,$7.00,$2.33 / 100ML
Thanks To Nature Volume Boost Shampoo With Biotin 500ml,$9.00,$1.80 / 100ML
Dove Advanced Care Original Antiperspirant Aerosol 220ml,$8.50,$3.86 / 100ML
Libra Girl Ultra Thins Pads Wings Regular 12 Pack,$3.50,$0.29 / 1EA
Libra Invisible Super Pads With Wings 12 Pack,$4.45,$0.37 / 1EA
Radox Feel Heavenly Coconut Body Wash & Shower Gel 1l,$9.50,$0.95 / 100ML
Palmolive Naturals Active Nourishment Conditioner Aloe Vera 350ml,$6.00,$1.71 / 100ML
Reef Tanning Oil Coconut Sunscreen Spf 30+ 125ml,$14.00,$11.20 / 100ML
Robitussin Cough Syrups Chesty Cough 200ml,$12.00,$6.00 / 100ML
Essentials Facial Tissues 224 Pack,$1.70,$0.76 / 100SS
Kleenex Everyday 2 Ply Facial Tissues 200 Pack,$3.00,$1.50 / 100SS
Quilton Facial Tissues Soft White 95 Pack,$1.40,$1.47 / 100SS
Kleenex Aloe Vera & Vitamin E 3 Ply Facial Tissues 95 Pack,$2.60,$2.74 / 100SS
Kleenex Aloe Vera & Vitamin E 3 Ply Facial Tissues 140 Pack,$3.60,$2.57 / 100SS
Symphony Facial Tissues White 228ss 3 Pack,$5.00,$0.73 / 100SS
Kleenex Large & Thick 3 Ply Facial Tissues 95 Pack,$2.80,$2.95 / 100SS
Swisspers Cotton Tips 240 Pack,$4.80,$2.00 / 100EA
Gillette Sensitive Skin Soothing Shave Gel Aloe Vera 195g,$7.00,$3.59 / 100G
Head & Shoulders Apple Fresh Anti Dandruff Shampoo 660ml,$21.00,$3.18 / 100ML
Nivea Rich Lather Natural Aloe Vera Moisturising Body Wash 1l,$11.90,$1.19 / 100ML
Colgate Plax Antibacterial Mouthwash Freshmint Alcohol Free 1l,$12.00,$1.20 / 100ML
Ogx Argan Oil Shampoo For Dry & Damaged Hair 88.7ml,$7.00,$7.89 / 100ML
Systane Complete Lubricant Eye Drop 10ml,$18.80,$188.00 / 100ML
Glow Lab Coconut & Spiced Fig Hand Wash 300ml,$4.00,$1.33 / 100ML
Colgate Plax Antibacterial Mouthwash Peppermint Alcohol Free 500ml,$3.50,$0.70 / 100ML
Glow Lab Amber & Sage Hand Wash 300ml,$4.00,$1.33 / 100ML
Invisible Zinc Sheer Defence Spf 50 Tinted Moisturiser Sunscreen Medium 50g,$27.20,$54.40 / 100G
Gillette Blue 3 Disposable Shaving Razor 8 Pack,$13.00,$1.63 / 1EA
U By Kotex Ultrathin Overnight Pads Long With Wings 8 Pack,$3.50,$0.44 / 1EA
Vo5 Wet Look Styling Gel 175ml,$5.00,$2.86 / 100ML
Hot Hands Hand Warmers 1 Pair,$2.20,$2.20 / 1EA
Gillette Venus Comfortglide White Tea Razor Blades 8 Pack,$40.00,$40.00 / 1EA
Strepfen Intensive Throat Lozenges Honey & Lemon 16 Pack,$7.50,$0.47 / 1EA
Schwarzkopf Nordic Blonde Toner Anti-yellow 200ml,$15.00,$15.00 / 1EA
Panadol Rapid Soluble Tablets For Pain Relief Paracetamol 500mg 20 Pack,$6.25,$0.31 / 1EA
Tresemme Purple Toning Shampoo 500ml,$17.00,$3.40 / 100ML
Colgate Barbie Or Batman Toothbrush Barbie Or Batman Toothbrush Each,$12.00,$12.00 / 1EA
L'oreal Paris Elvive Hyaluron Plump Moisture Filling Shampoo 300ml,$8.50,$2.83 / 100ML
Rexona Clinical Protection Men Anti Perspirant Stick Deodorant 45ml,$14.00,$31.11 / 100ML
Sensodyne Pronamel Gentle Whitening Toothpaste 110g,$9.70,$8.82 / 100G
Essentials Facial Tissues 224 Pack,$1.70,$0.76 / 100SS
Kleenex Everyday 2 Ply Facial Tissues 200 Pack,$3.00,$1.50 / 100SS
Quilton Facial Tissues Soft White 95 Pack,$1.40,$1.47 / 100SS
Kleenex Aloe Vera & Vitamin E 3 Ply Facial Tissues 95 Pack,$2.60,$2.74 / 100SS
Kleenex Aloe Vera & Vitamin E 3 Ply Facial Tissues 140 Pack,$3.60,$2.57 / 100SS
Symphony Facial Tissues White 228ss 3 Pack,$5.00,$0.73 / 100SS
Kleenex Large & Thick 3 Ply Facial Tissues 95 Pack,$2.80,$2.95 / 100SS
Swisspers Cotton Tips 240 Pack,$4.80,$2.00 / 100EA
Balnea Mango & Peach Body Wash 500ml,$2.40,$0.48 / 100ML
Help@hand Ibuprofen Mini Caps 24 Pack,$2.40,$0.10 / 1EA
Lynx Voodoo Deodorant Aerosol Bodyspray 165ml,$8.00,$4.85 / 100ML
Schwarzkopf Extra Care Aqua Revive Moisturising Conditioner 400ml,$9.00,$2.25 / 100ML
Gillette Shaving Foam Lemon Lime 333g,$5.50,$1.65 / 100G
Voeu Micellar Water 200ml,$4.00,$2.00 / 100ML
Canesten Tinaderm Antifungal Powder Spray 100g,$12.00,$12.00 / 100G
Redwin Vitamin E Cream With Evening Primrose Oil 330g,$4.20,$1.27 / 100G
Schick Hydro Silk Touch Up Disposable Razors 3 Pack,$10.00,
Thanks To Nature Repair And Protect Shampoo With Hemp Seed Oil 500ml,$9.00,$1.80 / 100ML
Dove Womens Roll On Deodorant Invisible Dry 50ml,$5.00,$10.00 / 100ML
Gillette Blue2 Pivot Plus Shaving Razor Each,$12.00,$1.09 / 1EA
Neutrogena Makeup Remover Cleansing Wipes 25 Pack,$8.50,$0.34 / 1EA
Simple Biodegradable Facial Wipes 50 Pack,$14.00,$0.28 / 1EA
Pantene Pro-v Smooth & Sleek Conditioner For Frizzy Hair 375ml,$5.00,$1.33 / 100ML
Bosisto's Aroma Sleep Mist 125ml,$10.00,$8.00 / 100ML
Voeu Brightening Face Mask Each,$2.40,$2.40 / 1EA
Rexona Men's Antiperspirant Pump Deodorant Sport 150ml,$7.80,$5.20 / 100ML
Pantene Pro-v Smooth & Sleek Conditioner For Frizzy Hair 900ml,$10.00,$1.11 / 100ML
Chapstick Lip Care Strawberry Lip Balm Sunscreen Spf 15 4.2g,$2.70,$64.29 / 100G
Listerine Teeth Defence Antibacterial Mouthwash 500ml,$10.00,$2.00 / 100ML
Skyn Condoms Skyn 20 Pack,$18.00,$0.90 / 1EA
Vicks Vapodrops Xtra Strong Menthol Blast 16 Pack,$6.40,$0.40 / 1EA
Essentials Facial Tissues 224 Pack,$1.70,$0.76 / 100SS
Kleenex Everyday 2 Ply Facial Tissues 200 Pack,$3.00,$1.50 / 100SS
Quilton Facial Tissues Soft White 95 Pack,$1.40,$1.47 / 100SS
Kleenex Aloe Vera & Vitamin E 3 Ply Facial Tissues 95 Pack,$2.60,$2.74 / 100SS
Kleenex Aloe Vera & Vitamin E 3 Ply Facial Tissues 140 Pack,$3.60,$2.57 / 100SS
Symphony Facial Tissues White 228ss 3 Pack,$5.00,$0.73 / 100SS
Kleenex Large & Thick 3 Ply Facial Tissues 95 Pack,$2.80,$2.95 / 100SS
Swisspers Cotton Tips 240 Pack,$4.80,$2.00 / 100EA
Garnier Fructis Coconut Water Conditioner 315ml,$5.60,$1.78 / 100ML
Poise Pads For Bladder Leaks Overnight 8 Pack,$6.95,$0.87 / 1EA
Thursday Plantation Tea Tree Face Wash For Acne 150ml,$7.80,$5.20 / 100ML
Head & Shoulders Smooth & Silky Anti-dandruff Conditioner 660ml,$21.00,$3.18 / 100ML
Johnson's Normal Wipes Cleansing Normal Skin 25 Pack,$4.30,$0.17 / 1EA
Manicare Flat Tweezer Gold Tipped Each,$11.60,$11.60 / 1EA
Voeu Moisturiser For Most Skin Types With Spf 15 150ml,$4.00,$2.67 / 100ML
Dove Body Wash Sensitive Skin Hypo-allergenic 1l,$17.00,$1.70 / 100ML
Evamay Pads With Wings Super 14 Pack,$2.20,$0.16 / 1EA
Listerine Freshburst Antibacterial Mouthwash 1l,$12.50,$1.25 / 100ML
Bondi Sands Self Tanning Foam Ultra Dark 200ml,$18.20,$9.10 / 100ML
Pantene Ultimate 10 Repair & Protect Conditioner For Damage 900ml,$10.00,$1.11 / 100ML
Rexona Women Clinical Roll On Shower Clean 50ml,$8.00,$16.00 / 100ML
Difflam Plus Anaesthetic Spray 30ml,$15.20,$50.67 / 100ML
Pokemon Miraculous Jurassic Battery Powered Brush Each,$12.00,$12.00 / 1EA
Disney Frozen 2 In 1 Shampoo & Conditioner 350ml,$6.00,$1.71 / 100ML
Betadine Sore Throat Gargle Concentrated 15ml,$13.80,$92.00 / 100ML
Palmolive Naturals Body Wash Sea Minerals Shower Gel 500ml,$6.50,$1.30 / 100ML
Garnier Fructis Hair Food Volumising Watermelon Conditioner 350ml,$13.00,$3.71 / 100ML
L'oreal Elvive Extraordinary Oil Nourishing Conditioner 300ml,$8.50,$2.83 / 100ML
Le Tan In Le Can Self Tan Deep Bronze 150g,$16.00,$10.67 / 100G
All Smiles Pro Battery Powered Toothbrush Each,$9.00,$9.00 / 1EA
Mitchum Women's Roll On Powder Fresh Antiperspirant & Deodorant 50ml,$3.50,$7.00 / 100ML
Difflam Sore Throat Lozenges Honey & Lemon 16 Pack,$6.50,$0.41 / 1EA
Essentials Facial Tissues 224 Pack,$1.70,$0.76 / 100SS
Kleenex Everyday 2 Ply Facial Tissues 200 Pack,$3.00,$1.50 / 100SS
Quilton Facial Tissues Soft White 95 Pack,$1.40,$1.47 / 100SS
Kleenex Aloe Vera & Vitamin E 3 Ply Facial Tissues 95 Pack,$2.60,$2.74 / 100SS
Kleenex Aloe Vera & Vitamin E 3 Ply Facial Tissues 140 Pack,$3.60,$2.57 / 100SS
Symphony Facial Tissues White 228ss 3 Pack,$5.00,$0.73 / 100SS
Kleenex Large & Thick 3 Ply Facial Tissues 95 Pack,$2.80,$2.95 / 100SS
Swisspers Cotton Tips 240 Pack,$4.80,$2.00 / 100EA
Bosisto's Nasal Spray Eucalyptus Saline 50ml,$8.00,$16.00 / 100ML
Dettol Antibacterial Foam Hand Wash Refill Rose And Cherry 900ml,$4.75,$0.53 / 100ML
Voost Hydrate Electrolyte Tablets 20 Pack,$9.60,$48.00 / 100EA
So? Unique Sweet Pea Body Spray 150ml,$9.95,$6.63 / 100ML
Clearwipe Lens Cleaner 20 Pack,$4.80,$0.24 / 1EA
Rimmel Lasting Finish Full Coverage Foundation 200 Soft Beige 30ml,$24.00,$8.00 / 10ML
Toni & Guy Strength Plex Bond Repair Shampoo 250ml,$9.50,$3.80 / 100ML
Sanofi Hydrogen Peroxide Powerful Bleach Liquid 200ml,$4.30,$2.15 / 100ML
Balnea Coconut Body Wash 1l,$4.50,$0.45 / 100ML
Veet For Men Hair Removal Cream Normal Skin 200ml,$11.50,$5.75 / 100ML
Bic Soleil Comfort Scented Razors Citrus 3 Pack,$5.60,$1.87 / 1EA
Libra Pads Wings Super 12 Pack,$3.50,$0.29 / 1EA
Simple Water Boost Facial Cleanser Micellar Water 400ml,$9.80,$2.45 / 100ML
My Soda Purple Toning Blonde Shampoo 350ml,$10.00,$2.86 / 100ML
Lynx Black Bodywash For Men Shower Gel 400ml,$6.50,$1.63 / 100ML
Zen Liniment Spray 100ml,$19.50,$19.50 / 100ML
Eureka Eucalyptus Solution 500ml,$14.00,$2.80 / 100ML
Gillette Sensitive Skin Soothing Shaving Foam Aloe Vera 245g,$6.50,$2.65 / 100G
Schwarzkopf Extra Care Daily Oil Elixir 100ml,$17.00,$17.00 / 100ML
Skin Republic Hyaluronic Acid & Collagen Face Mask Each,$4.80,$15.00 / 100G
Toni & Guy Shampoo For Fine Hair 250ml,$9.50,$3.80 / 100ML
Skyn Original Natural Feeling Non-latex Condoms 10 Pack,$9.50,$0.95 / 1EA
D3 K6.0 Kinesiology Tape Each,$10.00,$10.00 / 1EA
Libra Pads Extra Wings Regular 14 Pack,$3.50,$0.25 / 1EA
Essentials Facial Tissues 224 Pack,$1.70,$0.76 / 100SS
Kleenex Everyday 2 Ply Facial Tissues 200 Pack,$3.00,$1.50 / 100SS
Quilton Facial Tissues Soft White 95 Pack,$1.40,$1.47 / 100SS
Kleenex Aloe Vera & Vitamin E 3 Ply Facial Tissues 95 Pack,$2.60,$2.74 / 100SS
Kleenex Aloe Vera & Vitamin E 3 Ply Facial Tissues 140 Pack,$3.60,$2.57 / 100SS
Symphony Facial Tissues White 228ss 3 Pack,$5.00,$0.73 / 100SS
Kleenex Large & Thick 3 Ply Facial Tissues 95 Pack,$2.80,$2.95 / 100SS
Swisspers Cotton Tips 240 Pack,$4.80,$2.00 / 100EA
Thanks To Nature Smooth & Control Conditioner With Keratin 500ml,$9.00,$1.80 / 100ML
Palmolive Men Rapid Shave Sensitive Foam With Aloe Vera 250g,$4.50,$1.80 / 100G
Wart Off Stick Remover 5g,$14.00,$280.00 / 100G
Carefree Barely There Unscented Panty Liners 42 Pack,$3.50,$0.08 / 1EA
"Clearblue Pregnancy Test, Ultra Early 3 Pack",$19.00,$6.33 / 1EA
Dove Nourishing Moisture Conditioner For Dry Hair 320ml,$7.70,$2.41 / 100ML
Vaseline Total Moisture Lotion 1.5L - Dry Skin,$18.00,$1.20 / 100ML
Pantene Micellar Rosewater Moisturising Conditioner 530ml,$9.00,$1.70 / 100ML
Help@hand Ibuprofen Soft Gel Capsules 200mg 20 Pack,$2.60,$0.13 / 1EA
Musashi Alpha 750 Ml Size Shaker Clear Red Each,$14.99,$2.00 / 100ML
Femfresh Sensitive Wash 250ml,$5.25,$2.10 / 100ML
Essano Rosehip Oil Certified Organic 20ml,$24.00,$120.00 / 100ML
